Post,Name,Datetime,Story,year
post-7142367,The Gift of Fish,"Jul 15, 2021 at 8:12 PM","... we're going to Sizzler cos we got some celebratin' to do! 




If I go online and win this extra dollar bonus, what do I spend it on? What would you spend it on? Would you go wild and spend it all at once or would you be prudent and save some of it for a rainy day?

Decisions, decisions, decisions.",2021
post-7139982,June132017,"Jul 14, 2021 at 1:27 AM","A guy named Russel ordered a Lyft. So looking at the map it pretty much was making a u-turn down the road. So, I happen to pull over to a power station where I guess the trucks service them. Anyway, this shaved over 2 miles off his pickup and probably 4 mins. Well, it wasn't meant to be. He then cancelled after 25 to 30 seconds. I literally face palmed. I guess it's like hitting a homerun and losing.

A couple of times I made a wrong move and made the pickup longer and the rider didn't even cancel. These free cancels just suck.",2021
post-7137806,Bojingles,"Jul 12, 2021 at 5:15 PM",My account has never been placed on hold for a background check until now 6 days and counting.Poor a.ss business performance,2021
post-7136004,MissAnne,"Jul 10, 2021 at 8:40 PM","Guess things in Salt Lake City are getting back to normal, there are 4 to 5 concerts tonight in the valley, including one at Usana, just down the road from me.

This is the most surge I have seen in a year. And of course, hubby has the car",2021
post-7029729,touberornottouber,"Apr 14, 2021 at 12:00 PM","I get a ride request to go to an apartment. When I arrive it shows me that it is a scheduled ride for 9:45 - 9:55. It is 9:46 so I message them to let them know i am in front of the building (there are 30 buildings in this complex and the GPS is often off). She messages back that she will need a couple minutes. I say ""no problem"" because I can live with 2-3 minutes. But then she messages back that she ""uses the scheduled rides to give her some extra leeway"". (she is thinking that she has until 9:55 to come out and is starting to get snooty with me). I consider messaging back to tell her, no, she misunderstood how it works but thought better of it as you never know how they will react. I also consider whether I should just cancel the ride then and there and leave to avoid having to deal with her but decide to let it go.

It finally tells me I can now cancel and get paid. I decide to wait an extra three minutes just to be a nice guy (I really am not a jerk honest). Finally I am over 8 minutes in now. It's 9:54 so I cancel.

She was going to wait to 9:55 to ""show me"" and make me wait for being ""impatient"". I wonder how that worked out for her? I drove away about $4.50 richer. Sorry lady but I ain't your butler and your ride was going to be a minimum fare. I am sure she was ont he phone with Uber. Hopefully they told her how it works but I doubt it.",2021
post-7129924,losiglow,"Jul 4, 2021 at 4:19 PM","I thought a thread dedicated to funny screenshots would make for a good laugh. These can be ones that show some crazy low pax rating, wacky pax messages through the app, funny notifications from Lyft or Uber or anything else that made you raise an eyebrow and you thought quick enough to screenshot it.


Here's one I had with the longest ping I've ever gotten. 34 minutes and probably 30 miles to pick up a pax. Yeah, I'll get right on that!  





Here's one where my AR and CR both plummeted to 0%. Good for the CR but wow. I didn't know I was turning down that many rides. Turns out it was a glitch of course. Returned to normal the next day.




Anyone getting these crazy long waits for scheduled rides lately? I've made a habit of checking beforehand because Uber will sometimes send me to a pax when there's as much as 30 minutes before their scheduled ride. Wow. Just wow. Needless to say, I cancelled with a ""don't want to wait"".

",2021
post-7120846,Dr.Y,"Jun 25, 2021 at 11:06 AM","Hello all,
I drive in Chicago, and today I had someone named ozasee for a ride. I discovered he wasn't wearing a mask, and refused to put one on. Once he did, it was under his chin, and I repeatedly asked him to put it on. He put it under his nose, and started complaining about Chicago not having a mask mandate. I explained it was Uber's policy, and Chicago had nothing to do with it. He refused to put it on, so I pulled over to a gas station, and ended the ride. He then refused to get out of the car, and I had to call the police. This is how my day started today. His pickup location was . He was verbally abusive about getting out of the car, and wouldn't get out. Uber sent him a message reminding him about the mask, and he will have to prove with a photo that he's wearing a mask before getting a ride. Nothing about him being rude or anything from Uber. Stupid useless people in that company. Just be warned about this person named ozasee in Chicago.",2021
post-7131178,Benjamin M,"Jul 5, 2021 at 11:59 PM","


As some know here, I decided to go and get a ""real job"" like my wife had been ""suggesting"".

""You know, a W-2. No, I don't care if you don't want to flip burgers! 

Well, I thought that I was doing pretty well driving Uber (after expenses, still about what I earned as a paramedic) but my 2018 Civic hit 70k and gas prices are through the roof.

So, ""real job"".

Back to EMS? Still a maybe. But I'm not in my 20s anymore, a touch of PTSD, and two hernias.

Back to programming? Competitive, also for the young, and I do not want to be behind a desk.

Law enforcement? That was on my horizon before we moved to the big city and ""stuff"" happened.

So, one night, I decided to send a Facebook message to a limousine company that I first noticed before I started rideshare full time, brand new to the city life. Instant reply, I was hired on the spot two days later.

First vehicle I drove was a Chrysler 300. Brakes were shot. Second, another 300, tires were bald and one had an enormous chunk of rubber missing.

Soul searched for about three days (and posted here). Decided to give them the benefit of doubt, just as I would want, emailed them basically saying that they are awesome but I can't drive unsafe shit.

Owner's girlfriend stepped in, took care of everything like a boss, and I am now driving their best. The pandemic nearly killed their business, that section of the fleet is just now becoming more in demand.

Now, Winifred. She had just become a regular when I started - very ""well to do"". First trip was from an independent care facility (now assisted living unit, she's not happy) to the afternoon Mass.

I was warned in advance (and given a salute by her last driver) before I headed to pick her up - third trip for the company. Very demanding pax and she needs a lot of help getting in and out of the car.

She asked me to do five things at once, said she's old enough to be my grandmother (Mom's her age), AC was either too hot or too cold, and made me pull over to find the right radio station. All in the first five minutes 😂

First time waiting for a pax on the job. People were commenting on the fancy car parked by the door to the church. It was her first Mass since the pandemic began.

After I got her situated in the car again, she started to apologize for how she acted before. I cut her off. Told her that I know chronic pain when I see it (arthritic, obese) and how it can definitely **** with your mood. And I told her to stop calling herself old.

Dropped her off, called the company, and told them that if Winifred ever needs a ride to PLEASE let me know. And she requested me for her next trip.

Mass again yesterday, this time I joined her. Boss asked if we needed to charge extra for an escort. 😂

And that's my Sunday moving forward. Paid a decent amount to drive a friend (Winifred said I'd better not think of her as a pax) to church and back.

Oh, and here I am picking up her phone off of the road yesterday because I put it on the roof and forgot. Not a scratch. Divine intervention??😳




Rideshare has been either extremely profitable here or less than minimum wage, just seems to be how the wind blows. Tips are pretty much unheard of, pick up distance is still pretty high for most pings. Pax are still left stranded at our airport.

Even though I'm not totally down with it (seems a bit low), I earn $10/hr from when I leave the ""garage"" (that can be home if the car isn't needed before or between trips) until I return.

unlike Uber and Lyft, tips are included, minimum of 18% - and many fares are $200+. So, no dead miles and no expenses. Lately driving a 2019 Lincoln MKT, 2017 Continental, 2019 Suburban, and soon a 2020 Continental.

Pax run the gamut, from Winifred to newlyweds, executives, flight crews (airport to hotel and back), organ transplant teams, and - last week - a show creator for AMC followed by his lead actor.

I was star struck enough, then had the surreal experience of the main man behind the show asking me to stop so he could literally run a block to an ATM so he could tip me $20 cash (in addition to the $20 or so included, short airport run).

In conclusion, companies like this are hiring. ""Oh, rideshare drivers are un employable"" - bullshit. I submitted a resume, showed up on time wearing a suit, ""here's where the keys are, water bottles are over there, when can you start"" - that was the interview.

So, if you are burnt out being an ""ant"" (hate that term but whatever), consider the option. And I'm part time for now, still ""anting"" on and off.

My theme song right now -



",2021
post-7136351,SicilianDude,"Jul 11, 2021 at 6:10 AM","Ok we all know that Lyft is ripping everyone off from both ends while we’re doing all the work but I gotta admit that driving the graveyard shift with Lyft in Chicago is still making me $46 an hour average and I even got five times in two months. All I do every night is pick up hot chicks in mini skirts and high heels and then do lots of club hopping!

Finally, got some perks!",2021
post-7137560,Uber_J,"Jul 12, 2021 at 12:31 PM","A 17-year-old  girl has been accused of stabbing and killing an  driver in National City. 
Police said they found Raquel Spohn Wehber, 58, in her car near a neighborhood market with multiple stab wounds last Tuesday. 

How do you like this story?




I felt unsafe couple of time with female passengers on the back who were fooling around while I drove them. Nothing bad happen though. But new generation have no respect to anything.",2021
post-7135622,June132017,"Jul 10, 2021 at 1:04 PM","I figured it wasn't worth doing. Probably 10 mins to get there and 15 mins to get out of the concert traffic. I figured people would understand to tip. So I did an experiment and see if they would tip. Nope. Both rides didn't tip yet. 

Then some random guy tips $5 on a 10 minute ride not involving the concert. Lol, you can't make this stuff up. 

$5 was what I was looking for the concert traffic. $10 for generous tippers in the concert traffic. Maybe $20 if they wanted to really tip.",2021
post-7133187,June132017,"Jul 8, 2021 at 1:44 AM","I guess these renters didn't pay rent for a while. So the guy there was pretty nice and asked me if he could put all this junk and an air conditioner in the trunk. ""Sure, why not?"" 

So he loaded up the trunk with trash bags full on items. Luckily he closes the trunk nicely after a few attempts. So then a kid and the 2 adults get in the car. 25 miles away to Day's Inn we go. 10 mins for them to unload there. Metal silverware starts piercing the bags and falling to the cement. In my mind: ""yep, this verifies the eviction ride theory."" 

At least they realized I cut them a break because at first I was saying I didn't want alot of stuff in my car. They seemed very grateful which was nice.",2021
post-7125903,FLKeys,"Jun 30, 2021 at 1:00 PM","Got an invitation to accompany a lady to her room. In this case it was a bungalow. I politely declined and moved about my evening. She was attractive, and a little tipsy. Wouldn't say drunk, but definitely feeling the buzz.

Just got a voice mail from her, thanks for giving my number out Uber. She left her sandals under my passenger side front seat, could I kindly bring them to Bungalow 8 tonight between 8 and 9 PM. Call her if I have any questions. the number she left matches the number she called from, so not an Uber line. Ran out to my car and sure enough there are a pair of sandals wedged under the seat.

When I leave at work tonight and drive by the resort I will be leaving the sandals with the front desk and the instructions to deliver them between 8 & 9 PM. Let them deal with it.

This is my 3rd offer in just over 3 years. Hope it is my last.",2021
post-7131597,Cvillegordo,"Jul 6, 2021 at 11:40 AM","I've been driving in the Charlottesville Virginia area since the fall of 2019. I have taken rides to Richmond Harrisonburg and Stanton and picked up rides in those areas on the way back. I've also gone as far North as Culpeper but did not get any pings on the way back from there. My understanding has always been that if I were to take a longer trip for example to Dulles airport, that I could set my destination to return and possibly get trips along the way. I have never done this because it doesn't seem to make sense financially, Is too much time and too many dead miles. I've always assumed that I'm not authorized to drive in that area, other than in a return situation. Yesterday I had a conversation with support about my annual inspection. I uploaded the new certificate and they did not automatically lift the hold; I had to call them. After the rep helps me out she did confirm that my area includes anywhere in Virginia. She also said that if I can go online that means I can get trips. My wife and I are in NoVA, DC and Maryland 2 to 4 days a week for her work. I always play with the app to look at surges and so forth, and I have always been able to go online in those areas; I haven't tried to actually take trips or pings simply because I've never been in my car, I'm always in my wife's company car but theoretically I COULD take my car, I spend 4-8 hours amusing myself while she works, the idea is tempting, except for the problem of putting huge miles on my car just for a few bucks.. Support has told me quite a number of incorrect things in the past so is this person correct or is this person confused? Is it true that if you can go online, you will get pings? When my inspection was expired for the last several days, I could still go online - I just wasn't getting any pings. So that tends to refute the information that support told me already. Thoughts?",2021
post-7134017,June132017,"Jul 8, 2021 at 10:36 PM",Once on Monday and once on Wednesday. I got $3 out of the Wed. cancel while in route. Thoughts?,2021
post-7131667,FLKeys,"Jul 6, 2021 at 1:49 PM","Well not really Urine, however the PAX should not have lied.

I get to a pick-up and there is a guy and girl in bathing suites. She is wrapped in a beach towel, he does not have one. Doors are locked, I roll down window and ask are you wet, you can't get in if you are wet. If you are still wet I have extra towels in the back. Guy replies no they are not wet. I repeat I have extra towels in the back you can sit on. He says no we are not wet. 

I open the doors and they get in. Take them several miles to a resort. Talk about how people want to get in while wet and I can't drive anymore until my seats dry. She gets out and her towel falls off, okay string bikini the size of yarn explains why she was wrapped up in a towel. I pull away and decided I better check the seat behind me. Idiot lied, I could clearly see where his bathing suit was wet and left my seat wet.

I turn the app off, take pictures and send in a urine complaint to Uber, after all he said he was not wet so he must have pissed his pants.

Took about two hours for Uber to respond along with $10 for cleaning fee and 5 extra Uber Pro points would be added to my total. Replied back that I had to have my seat cleaned as he pissed in it and they replied back that rider claimed his bathing suite must have been wet from swimming. I replied back with the conversation I had with the rider and also uploaded the video and sent them a link. Explained the video clearly shows he said he was not wet. After some back and forth for two days now Uber finally sent me another $70 for a total of $80.

And what is up with the 5 extra Uber Pro points? Told them I had no use for the Uber Pro Points. The never responded to that.",2021
post-7132940,EM1,"Jul 7, 2021 at 9:05 PM","They survived; the driver in National City did not.

worth risking your life?

",2021
post-7131227,June132017,"Jul 6, 2021 at 1:03 AM","So there was this beautiful oak looking antique wooden chair in the middle of the on-ramp. I just made sure it was clear and avoided the chair. When I passed it looked like one of the legs broke. I guess it fell out of a pickup truck. The chair landed on a on-ramp to a 65 MPH highway.

So later on I was on the same ramp. I didn't even realize it until I saw the chair obliterated into hundreds of pieces. Another truck probably had a bad day and smoked that chair. They probably messed up the radiator.",2021
post-7111027,ANT 7,"Jun 15, 2021 at 3:55 PM","Ar 4:55 I get the text......""be right out"".........

At 5:01 I'm driving down the road outta there, and I see this dude running down the street waving at me in my rear view mirror.

He looked like Dara......closely cropped faux 5 o'clock shadow......starting to go bald, just missing the fake teeth.

No, I didn't stop.",2021
post-7127067,June132017,"Jul 1, 2021 at 11:34 AM","So I picked up this one guy let's name him ""Chad."" I picked him up with him and what I figure is his girlfriend about half a dozen times. The girlfriend is very pretty in my opinion. So last night I was shocked to get a request from ""Chad"" at the hotel. So who is waiting there? Some girl who isn't Chad's girlfriend and Chad and girlfriend aren't there. She has all these tattoo's and was dressed up to the 9's. Intresting. Maybe they we're all just partying together, I don't know. I think I know what's going on here though. Luckily the ride went smooth for me.",2021
post-7124534,JeanOcelot0,"Jun 29, 2021 at 1:50 AM","These medallion owners and their banks have been taking it on the chin.

",2021
post-7130140,Stevie The magic Unicorn,"Jul 4, 2021 at 9:28 PM","So I picked this lady up from a mini mall Pizza Hut.

she wanted to just pay for 2 hours of time at $35 an hour.

“uhh”

sure ok. So with the $17 already on the meter plus 2 hours that will be $87?

“yeah 2 hours”


Ok swipe your card now..



and aside from a trip to 711 nothing.

just sitting here in a parking lot.

like derping here in a parking lot on the four to of July… dispatch is screaming for cabs and I got $87 for like 2 hours 15 minutes of nothing.

Really…

Strange…

1 hour 22 to go.",2021
post-7130917,ANT 7,"Jul 5, 2021 at 7:24 PM","This pic is not photoshop. I took it this afternoon. Vehicle is not an Uber as it is missing certain regulatory decals, trade dress is the US term.

Kewl.

",2021
post-7122225,_Tron_,"Jun 26, 2021 at 4:19 PM","For anyone doing Eats profitably I say more power to you.

But I can't fathom why anyone would use this service. As a user of the Uber rider app, I have been getting deluged with emailed coupons to try Eats ""for free"". But free doesn't include the many many ancillary charges like service fees. First I tried to use a $30 coupon and got this:







Then I tried a $25 coupon and ordered $19 worth of food. With all the extra chargers the meal was going to be $15 out of pocket. None the less I ordered with a 15% tip up front. Was given a nearly 2-hour delivery window. Two hours later the order was cancelled on a ""your order could not be delivered"" error.

Tried the $25 coupon again for $26 of food. The free meal was going to cost nearly $10. Coupon or no coupon the misc chargers are hilarious:





""Delivery fee""? Service fee""?? ""CA Driver benefits fee""??? And on top of that a tip charge that defaults to 15%.

No thank you.",2021
post-7130089,The Jax,"Jul 4, 2021 at 8:36 PM","I was doing food delivery that day and stopped at Wawa to grab some things to eat and drink in between orders.

I am in line and there is this middle ages black guy in front of me. In front of him was this overweight guy. As the overweight customer is getting rung up, he all of a sudden went on some kind of fart storm. Like if you ate a lot of chili with beans in it and you just have a lot of gas with no expectation of using the bathroom. Just pressure and air.

So it basically went like this.....
<loud fart sound then stops>
""Oh god sorry i'm really sorry""
<more fart sounds after that then stop>
""Oh geez I am really sorry like oh my <fart sound> god""
<more farting>

The black guy in front of me turns around with such a disgusted look on his face like he was in the car driving past the sewage treatment plant on a hot day with the windows down.

Then he speaks LOUDLY while also using his hands in an explaining way....
<black guy voice with actual tactful pausing>
""You know... it smells like... someone is taking a poop... right here...
<points down with two fingers>
Like... I am standing in the bathroom stall... right next to the guy... who has food poisoning... and taking a massive diarrhea dump""

I busted out laughing so hard I had to grab the chip rack to keep me from falling. The entire store was laughing hysterically. The farting guy left real fast all embarrassed. It did stink in that general area from the farts. When the black guy gets up to the counter to pay, a woman behind me walks past me and offers to pay and thanks him for making her laugh so hard it made her day.

I guess I mean it was sad for the farting guy but the entire situation itself was funny. I wish that black guy was on TV like doing stand up. What a funny guy. He played it straight right after that, just kinda looking at everyone like come on now, this guy. Haha!!",2021
post-7127070,_Tron_,"Jul 1, 2021 at 11:38 AM","Uber badly wants me to drive again. It keeps sending incentive notices to my inbox. So as it happens I have been driving. Since last in the saddle I have lost Gold status, and my ability to see the destination of a ride request is now based upon the newish accepting 5 of 10 ride requests algo.

On the surface, the 5-of-10 algo seems to me like a halfway decent compromise, giving drivers up front details if they simply maintain a 50% acceptance rate. Of course drivers who accept a smaller percentage of rides will note that the low pay makes the 5-of-10 algo a joke. But even in my locale, where Uber still pays 98 cents a mile and 17 cents a minute, the 5-of-10 algo is a clown act. As anyone who has focused on the algo knows, acceptance rate is based upon each individual ride request, rather than on passenger request.

The downside of this nuanced difference played out for me yesterday with ""Darren"". Darren wanted a ride. Badly. His request for a long ride on the Lyft platform came to me, and I declined it. For my own good reasons I was unable to accommodate a pax who wanted a ride out of town. After all, I am an Independent Contractor and it is my right to choose which rides work for me. Darren then came in on the Uber app, which I also declined, lowering my 9 of 10 acceptance rate one notch. Undaunted, for the next half hour Darren toggled back and forth between platforms, requesting his out-of-town ride.

Uber, in all its wisdom, kept sending me Darren's requests. The algo was too dumb to realize that if I turned the request down once, nothing was going to change 5 minutes later. But the requests kept coming, and I noticed my acceptance rate was dropping with each successive decline. Finally, while on another ride, Darren's request came in again. Only this time there was no destination. I didn't realize the request was from stubborn Darren, and stupidly accepted it.

I drive the 10 minutes to the pickup point, then down a 1/4 mile dirt road, which cakes the back of my freshly washed car with dust, only to realize after starting the ride that my pax was the now infamous Darren. ""Darren, I'm so sorry. I can't drive you to xxx. I know there's not a lot of Uber cars on duty right now (being that a lot of drivers are still preferring UI) but I just can't do it"". Darren, whose family is just starting up a pot farm, replies in a most mellow way that it is totally cool, and to just drop him back to his pickup location. I do and move on.

Uber. Dude. I just want a reasonable driving experience. Anything less than that and you are de-incentivizing me. Get it?






And by the way, cancelling 2 out of 96 rides is a 2.13% cancellation rate. Not the 3% you are showing on my account.

",2021
post-7129897,losiglow,"Jul 4, 2021 at 4:03 PM","You'd think he'd get free Uber rides for life. But he resorts to Lyft? What does this tell you? 

At least he ordered a Lux and tipped well. He didn't look like his normal self. Pale white, heavy set and short. But still..... 

",2021
