Post,Name,Datetime,Story,year
post-6945989,Young Kim,"Mar 18, 2021 at 12:52 PM","I had a pickup in Mount prospect Illinois with a pax named Margaret who was going to a bar in Schaumburg Illinois. Hers was a fascinating story about how covid changed her life and completely turned everything around.

She works currently for Comcast and is a technical support agent. She said that when the pandemic struck last year they offered everyone who worked a 25% bonus in their hourly salary. Then because of the pandemic she was promoted finally to being a manager.. with a big salary raise in addition to the 25% bump.

Then all the sudden she said she felt like she hit the jackpot because Comcast said that everyone could work remotely. She said that was such a relief because she said that initially her office was in Schaumburg then they moved her to oakbrook and then finally to Bolingbrook Illinois. Her commute times went from 12 minutes to 30 minutes to 1 hour when she finally got located to Bolingbrook Illinois. The commute was killing her because sometimes when there was traffic it would be an hour and a half back home..

she loved being able to just work from her pajamas because she doesn't even have to be seen since she's a technical support agent. Then recently she said that they introduced at Comcast a text support feature. that means she doesn't even have to be on the phone anymore with a headset! She said that was a godsend because she was sick and tired of having to continue to talk to customers who would ramble on and on. She didn't have to talk over them anymore. 

She said she could also listen to music which she said was a first while she was working. She would just blast music and then she'd be on video with friends just hanging out. Sometimes she would just go to friends homes and even restaurants and just do her work from there.

She also said that she had just recently bought a brand new car because her old one broke down. But because of the pandemic she said that she was able to sell her car to her friend who gave her a very good price. so now she no longer has a car payment or has to pay for any insurance and just takes Uber when she needs to go somewhere but she says it's not often.

She said with all the promotions in the bump up and pay and the incredibly relaxing work and being able to sell her car that her finances completely turned around. She told me that she's saving up so much money for extended vacations to Italy and France and all around the world. she said she could never save money before the pandemic. She just yesterday got her third stimulus bonus by direct deposit as well.

She admitted that she feels terrible about this because she's knows a lot of people have gotten sick and died and she feels guilty about admitting to anybody how she feels. but she admitted to me that she's had a hard life and after years and years of difficult times, the universe finally rewarded her personally with the pandemic... She said her life was now better than ever. Better than it's ever been in her entire life. I've had a lot of pandemic stories that were somewhat positive in the last year but this one blew all the others out of the water...",2021
post-6928623,BobDaScotty,"Mar 12, 2021 at 5:57 PM","I have posted of late negatively about my Philly core demographic.

Now, here is the flipside.

Rider, mid-thirties, very curious about my accent, we got chatting. 30 minutes later we are well into each other's life stories and were discussing daughter parenting tips. 

Poor guy had a deadbeat mom situation with the courts bending over backwards to ignore that if the sexes were reversed he would be doing jail time.

He got out the car at a wawa and we shook hands goodbye. 


Another rider, veteran, discussed the world with me and all it's problems, including his son stationed overseas. Great guy. Sadly had to turn down his invite for me and kids to a family potluck because uber policy. 

I have many other heavily tanned such riders that make doing the job almost ok.

I really wish we could go back to segregation but with decent people / @$$holes.",2021
post-6935641,Guido-TheKillerPimp,"Mar 15, 2021 at 10:33 AM",Anyone else enjoying record demand and earnings💰? Seems as if all the Spring Breakers are making up for last year ☺,2021
post-6947337,ANT 7,"Mar 18, 2021 at 8:17 PM","Had to happen sooner or later, statistics being what they are.........3 years and almost 9,000 rides.

Stopped in the shitter lot at the airport to have lunch, because I just dropped a pax off for his flight. Dude parks beside me and walks over......checking out my vehicle body and then asking me for my documents. Of course my ""tax receipts"" were in order  so I talked to the guy for about 10 minutes before he left.

I asked him and he said he easily busts 1-2 drivers a day just by cruising into the waiting area at random. It's a big ticket too he said. Also, a lot of vehicles with evident body damage get their TNC licence pulled on the spot if they get caught. That is also as frequent according to him. He drives thru there 4-6 times a day according to a couple of the drivers I talked to after he left. My math tells me that about 3-400 Uber drivers are on the roads in our market over 24 hours at some point, so the number seems pretty low overall.

These dudes also told me that wait times are 2 - 2.5 hours for a ride right now. Why the **** do they sit there ? Max $ run to the end of our city is about $35 net to you if you are lucky enough to get one. Most are DT which pays $15.",2021
post-6837217,Fusion_LUser,"Feb 7, 2021 at 8:14 PM","Long Story short... I tossed a iPhone in the trash because I couldn't find a porta-potty...

I got a ping at a local sushi-bar to a local dive at 2.8x and the ride was about 8 minutes. Red flags did appear early but I ignored them because the ride requestor was pretty chill. Very chill considering the company he was with, or at least he appeared to be chill at that point. Anyway, 1 minute passed, 2 minutes then 3 minutes and close to the 4 minute mark one loud mouth chick comes out thinking she is Queen of Cool and Partying. As bad as she was the girlfriend appears at 5 minutes as I was about to cancel but the boyfriend was chill and said sorry about this... ""It's her birthday...""

This is the most lily-white chick I have ever seen. Take every white chick from a John Hughes film and combined them all and you have the birthday girl. However *every* other word out of her mouth was ""*****"" and/or ""****"". In to the car she sits yelling ""It's my birthday N***as! Lets party!""

We get out of the parking lot...

Where the **** are we going?
To the bar like you said you want to go...
Uber I just ****ing want you to know it's my BIIIIIIIIRRRRRTTHHHHDAY!
I get to ****ing be obnoxious on my BIRTHHHHHHDDAYYYY!
What's your name Mr. Uber?
Fusion....
Well it's my ****ing birthday. Let's party N***as!

We are not 2 minutes in to the drive and the boyfriend says save the partying for the bar.

**** THAT IT'S MY BIRTHDAY N***a! We ****ing gotta party.
Well chill for the bar you can't party here... 
<cutting the BF off> Uber doesn't ****ing care!
Uber I can have fun at my ****ing birthday right?
We've been partying all day and we are going to the bar to party. Chill!

Now the Birthday Girl gets super quiet. YAY!

We should ****ing just go back to the hotel since you N***as don't want to party.
Why the **** are we even going to the ****ing bar. This sucks. My birthday sucks.
Don't be like it's been a great day and we can party at the bar.
**** that I don't want to go to the bar anymore.
Well we are going because you want to go!

The last two minutes everyone was quiet and she was digging for something in her purse. We arrive at the bar the boyfriend and friend get out. The birthday girl doesn't. She is ""****ing looking for that cool gift she got from Wayne/Dwayne"" or whatever name she said...

Don't forgot your phone.
I'm not stupid I ****ing know where my ****ing phone is N**ga!
Where is the ****ing gift I got? Oh here it is. Look at this Uber!

It's been almost a minute now I'm done and said ""I have another ride I need to go pick up""

**** YOU N***A I WAS JUST BEING NICE. **** YOU *****"" as she gets out and slams the passenger side rear door.

She immediately opened the door again and screamed ""**** YOU *****"" and slammed it again. I locked the doors quickly this time and drove off. I did see the boyfriend laughing so now I'm like **** that guy! I went to another parking lot to file a complaint with Uber when I get a call from Uber messing the little complaint I was writing. Then the Birthday Girl's iPhone in the back seat starting ringing!!!

I don't answer my cell but I answer her cell phone and the nicest way I could

Hellooooooo
Hi this is blah blah blah we left our phone in your car
Would that be the phone of the loud chick or the **** you ***** chick?
Yeah sorry about that can you bring the phone back?

I can hear the Birthday Girl in the back say get my ****ing phone back I need that N***a!

I hang up.

Phone rings...

Hellllllllooooooooooo!
I'm really sorry guy we just want the phone back. Bring it back.

The birthday girl is still in the background yelling ""if that ****ing Uber if he doesn't bring my phone back right now I'm ****ing calling the police and reporting it ****ing stolen.""

Dude that chick was the most disrespectful person I've come by doing rideshare. Not only did she yell **** you ***** for no reason and slam my car door she did it twice while you sat there laughing! Tell **** you ***** girl I'm tossing her phone she can come find it.

No I was not laughing come on give me a break bring the...

I hang up. The whole time we are talking I'm heading for a gas station that has a porta-potty outside. I get there and it's gone! So I went a few doors down to a McDonald's with the phone ringing until I powered it off. I put some gloves on, cut open a trash bag right at the top of the trash bin and drop the phone inside it! The trash was nasty, smelly and wet.

I got two more calls from Uber but I didn't answer as I filed the complaint with Uber and said nothing about the lost phone. I got the canned response saying they will take this situation seriously blah blah blah and so far nothing about the phone. As of right now no drop in stars... I don't care if they do leave a bad feedback...",2021
post-6945953,Young Kim,"Mar 18, 2021 at 12:33 PM","One of my riders last night was a pickup from downtown Chicago going to a Northwest suburb last night. His name was Augustus. Nice conversation to start. I talked about sports (Cubs and Blackhawks) and then the weather. (There was rain last night in Chicago)

Then he suddenly asked me a question from out of the blue... ""What did you think about what happened during the elections?"". (My interior caution light went off of immediately). So I proceeded with caution...

I told him ""I'm not sure what happened but I know a lot of people thought there was some suspicious activity in the election"".

(Augustus): thank goodness I found someone else who agrees with me and half the country.

(Me). well I really can't comment too much because I don't know enough about the matter but what I read on various news outlets was that there was really irregular voting activity.

(Augustus). I looked out myself personally in Wisconsin and saw that there were more votes for the senators in the state than for the president. Who would go to a voting booth and not vote for the president? Also how could biden have gotten more votes than Obama? Why was there reports of hours passing in certain voting booths with 100% of the votes going for Biden and none for Trump? There was massive massive voting mail in ballot fraud.

(Me) not sure. I can see why many people would consider that.

(Augustus). You know it's really hard being a Republican in Chicago right?

(Me). Yes indeed. if you wore a red maga hat in downtown Chicago I think people would start hitting you.

(Augustus)...(he went on and on and on about how the Democratic policies were just destroying the country. He brought up how he thinks Kamala Harris is certainly going to become president if not Nancy pelosi. He told me that if Biden cannot serve 2 years then Nancy pelosi automatically according to the law becomes the president. (I'm not sure myself). He talked about how President Biden when he reads a teleprompter once he read the closed captioning brackets that introduced the next event. He said Biden was completely utterly demented, who is a puppet who is hiding in the basement. He continued saying Trump will prevail again in 2024. A lot of lies he said were spoken about the Democrats about the lethality of the virus... It went on and on and on ..and on.

(Me). (I just kept silent, trying to keep my integrity by not totally agreeing with the stuff about Trump's absolute greatness, vaccine data, masks, etc. BUT at the same time not arguing with Augustus. I stayed pleasant calm and polite throughout the entire interaction and ride. And listened with intention.)

At the end of the ride I found a $22.23 tip on my app...
",2021
post-6954119,Ummm5487,"Mar 21, 2021 at 9:33 AM",So now it seems most uber and lyft drivers in my market have quit....Im still out there but Im very proud of my fellow drivers for leaving these aszholes hanging....at the air port im always 0 in the que...away from the air port its ping after ping of angry pax who been waiting from 30 min to 3 hours one said...last night I was in another big city in my state and it was the samething...multiple pax stranded at the air port and i was the only driver....i racked up making nearly $300 but its looking like the tyranny is almost over....maybe uber lyft and the pax will now appreciate us a little more that we are seemingly gon!!!!,2021
post-6953857,The Gift of Fish,"Mar 21, 2021 at 5:42 AM","Uber recently lost its challenge in the UK courts to have its drivers classified as independent contractors. In a nutshell, the UK Supreme Court judged Uber's claims that it is merely a software platform that links pax and drivers to be nonsense, and that its drivers are indeed employees. Uber's reaction to making its UK drivers employees?



And:



So, in the UK, Dara and Co. accept that the UK ruling that its drivers are employees is a clearer path forward in giving its workers rights, and that it is willing to change its ways.

However, in California, the company sings along to a completely different tune. Voters decided in the Prop 22 election that Uber's drivers are not employees, but independent contractors. Uber's reaction?



And:



In California, Uber praises voters for deciding the polar opposite of the UK, and that decision to  class its drivers as employees is the best for the drivers.

Double-speak much? We, as drivers, have known for a long time that Uber has its bullshit generator running 24/7. However, up until now, the bullshit had largely been consistent. Now, Uber demonstrates that it will say whatever it thinks will benefit it the most, adapting the rhetoric at will to whatever situation it finds itself in, regardless of any contradictions with previously published positions.

Such duplicity would worry me greatly as an investor, particularly with reference to Dara's claims surrounding promised future profitability. However, with Uber's stock price still on an upward trend, none of this seems to worry the market. Go figure.

Sources:



",2021
post-6953519,ng4ever,"Mar 21, 2021 at 12:46 AM","It seems ok but just another way for customers to cheap out. We don't need cheaper services with need higher quality services that pay 80% of the fee to the driver always. I think a minimum fee of something would work even if it was only a few blocks. It would help filter out bad customers kinda. Not always though of course.

Anyway the service is where you use the customers car to drive. Not exactly sure how it works but it seems ok. At least your not putting wear and tear on your own car. Though I see disadvantages of this for the driver somewhat. What do you all think ? Good service idea by whoever created it? It is like $22 or $23 a hour depending on where you live. Seems like not enough for the driver.

Here. Sorry forgot the link.

/

If mods need to delete this it is fine.",2021
post-6949703,Juggalo9er,"Mar 19, 2021 at 4:11 PM","I'm doing a test to see how many. Lyft rides I can cancel before I'm deactivated..... no I don't care if they deactivate me at all.... I'm up to 41....

New age shuffling requires a different mindset....I don't drive the car that's in me profile anymore",2021
post-6951021,ubermikeo,"Mar 20, 2021 at 2:08 AM","Pax----> pick me up at this address.

Me----> It says in app the P/U is at the airport.

Pax----> It wouldn't let me put in my address

Me---->Cancel ride and request another. I can only P/U where app shows.

Pax---->I will cost me $6.00

Me----> Too bad",2021
post-6950921,ng4ever,"Mar 20, 2021 at 1:21 AM","Happens good amount years ago and now just recently happen again!

I know there suppose to be a feature soon at least in Uber where you can pick favorite drivers if you want. Could be good maybe. Even if it cost extra and requires greater wait time.",2021
post-6932385,dtwguy,"Mar 14, 2021 at 1:38 AM","This evening I picked up a passenger in Detroit. They weren't at the pick up location. I figured out that they were around the corner and down the street. When I got there they immediately started calling me names after getting in the car. Soon, they began calling me ""gay"", ""******ed"", ""ugly ass"" and using the N word repeatedly. 

I asked them to stop swearing and to just confirm their drop off (since the pick up was incorrect) and name. They continued to call me names and swear, yelling at me. Eventually, I called Lyft's emergency ride number. The ADT rep was wonderful. After hearing a few seconds of this, including the threats to ""F up my gay ****** ass"" they recommended calling the police or immediately ending the ride. I explained that the passenger was four minutes away and there was no easy way to get them out of the car. They said they would stay with me out of a concern for my safety. 

They continued to yell similar racial and other hateful comments as I drove (""no one will ever suck your Dxxx you ugly gay ******""). I remained silent and got them to their destination. Fortunately they got out, while still threating to kill me. 

The ADT safety rep was wonderful. She was kind and recognized that I was in shock. She offered assistance and stayed with me until I could breathe again. 

Lyft? They sent me an email asking me to call them. When I did they said they were too busy and to send them an email. 

Oh, and while I was on the phone with ADT emergency support they assigned me a new pick up. I'm a 5 star drive so I pulled it together and drove there. The passenger didn't show up. After waiting ten minutes and calling and texting six times I cancelled. I received a message that ""I needed to drive close"" even though I was a foot from the front door"". I'm still trying to get my cancellation fee. Fortunately I took a phot of me right under the address and at the front door! 

Meanwhile, there is a disturbed passenger out there willing to make multiple threats to kill a Lyft driver - and Lyft could care less. 

Be safe out there. 

#worstnightever",2021
post-6950437,_Tron_,"Mar 19, 2021 at 9:16 PM","Not a drinking reference. Occasionally a pax enters the car and either pours their heart out about their problems, or, wants a stranger to give them life advice. Kind a like patrons of bars are known to do.

What's the best and worst advice you ever gave a pax?",2021
post-6947055,Benjamin M,"Mar 18, 2021 at 6:18 PM","So, this notification popped up today. Do you think Uber will actually take our video evidence more seriously?

I have absolutely noticed a change of attitude in problem pax when they look up and see themselves on camera.


",2021
post-6865339,Ozzyoz,"Feb 18, 2021 at 1:36 AM","Everytime I get matched with a driver, the driver loves to wait blocks away so he can cancel for a mere 90 cent fee. Gas prices have increased on them I heard.

",2021
post-6932993,ANT 7,"Mar 14, 2021 at 10:33 AM","We have the 4th busiest airport in Canada with 18MM pax going thru it annually pre-covid.

Yesterday at 900 AM I dropped of a pax, my first in 2 weeks, who was actually flying somewhere. So, I took a pic.......normally the right side of the road has 2 lanes of parked cars side by side jockeying for position and open parking spots. This is just our domestic terminal, the international one was further up around the turn in the road, and was exactly the same.

Looks like a sci-fi movie..............

",2021
post-6865791,The Gift of Fish,"Feb 18, 2021 at 8:42 AM","As I was completing a ride yesterday, just before getting out of the car, the pax said, ""This is for you"". She reached over and put something on the armrest between the two front seats. ""Thank you very much"", I said. I then thought to myself, ""$10? $5?"". Alas, no, it was a bible-basher propaganda pamphlet with a cartoon picture of Satan on it, horns 'n' all, with the words, ""He's in disguise"" or some other such nonsense. Not the disguise I've ever seen - I took one look and thought, ""That's Satan"". Epic tip fail.

This is actually worse than my previous worst tip record holder. I had picked up a couple from a restaurant, and at the end of the ride the female pax offered me her table scraps that she had brought out with her, classily presented in the form of a paper plate covered with aluminium foil.

What has been the worst tip a pax has tried to offer you?",2021
post-6935811,bone-aching-work,"Mar 15, 2021 at 11:43 AM","I had been driving Lyftrash around for a few hours when I got a close-by ping for a man I've previously given rides to. Each time he has tipped me $5 on top of a lengthy trip.

Then comes the dreaded re-routing message. Ugh. The new ride's pick-up is 4 minutes away, at a grocery store. Usually I'd just cancel, but this was close enough, and it's a 50/50 chance the pax will be an employee leaving work.

I roll up to the front entrance, hit Arrive, and check out the destination... less than 1 mile away. I look inside the lobby, there's a frail, old woman leaning on a grocery cart with all her bags.

Cancelled. See ya later.

She's probably still waiting there. The cheese has taken almost all the drivers off the road here. Lyft shows high demand across the city, but can't cough up any dough for drivers to share in the surge. I was averaging about 10-15 declines during rides when it was trying to stack distant pick-ups on me.

These Lyft executives absolutely will not budge on increasing minimum fare compensation or distant pick-up premiums, so the customer experience is awful.",2021
post-6930729,#1husler,"Mar 13, 2021 at 1:31 PM","So I rolled up to an apartment yesterday morning to PU....parked directly on the ""pin"", no pax yet in sight, so proceeded to do some reading... moments later to get a pax message, ""I'm in front of you, don't you see me?!"", I looked up and...sure enough, pax was standing (waiting) like 15 feet in front of me...apparently needing me to PU exactly parallel with her...I presumed she might have mobility issues, but as I dropped off she seemed to be walking ok on her violation.

At least this is better than the reason-challenged question I get from pax ""Im right behind you, don't you see me?!"", as if drivers have eyes in backs of their heads to see you standing behind their car. If its an residential neighborhood, I'll also get ""didn't you see my house number?"" [its night, I'll be one house off, but rather than walk that one house over...pax is standing at his/her house number with an expectant expression on his/her face... I don't mind backing up 20 feet so his/her royal highness's feet don't get tired with the walk...only that I wish FUber would include a red carpet with their ""COVID supplies"", so I could park, roll out the red carpet for his/her royal highness to enter their chariot (to go to ""Le Dollar Generale"").

Perhaps the worse is getting the ""Im right behind you, don't you see me?!"" in a super busy commercial district where yours truly would have to take a few mins to go around the block in order to line up the pax car exactly with the pax feet, about 15 feet behind where I am...this I don't do, but instead invite them to walk the 20 feet forward for the PU....if it appears they can't walk do to disability, then ok, but if not for that reason...then I cancel and save the red carpet for the next pax.

",2021
post-6909911,touberornottouber,"Mar 6, 2021 at 11:13 AM","Sitting here during Daytona Bike Week. Got $20 for 5 rides so far. No surges at all today or yesterday. Last couple the guy tells me he is paying $27 for the ride. I'm getting $3.50.

Drop him off and it starts pouring down rain like a hurricane. They already gave me a queued ride at Starbucks (so probably a short ride with someone who doesn't want to walk in the rain). I cancel it and go to sign off. Before I can do that another pops up. repeat, then again and again. Eventually I am fast enough to sign off before they can pop another ride to me.

Yeah, I'm going to work in this weather for $4 a ride when you are charging the riders 500% surge. Go get 'em yourself Lyft. I'm staying home!",2021
