Post,Name,Datetime,Story,year
post-6882639,Superfreedomfighter,"Feb 24, 2021 at 12:13 PM",Twice in last eight months I had gotten this notification from Uber that that a pax has reported that I have not been wearing my mask improperly which is bs I use a neck gator at all times with pax in car over mouth and nose while pax constantly letting theirs slip off nose even removing to eat or drink and talk on phone and of course there’s no recourse for us drivers to rebut false claims or other than getting into confrontation with pax and ending ride when they do anybody else experience this?,2021
post-6873431,Superfreedomfighter,"Feb 20, 2021 at 9:56 PM",Since smaller communities in rural states like South Dakota don’t get much coverage on this site thought I’d post this since they not immune from rideshare company drama and welcome them to this site to share their concerns and issues dealing with companies and any other that they deal with in smaller remote rural cities,2021
post-6873725,kingcorey321,"Feb 21, 2021 at 12:50 AM","LOL getting any is something you may hear a teenage say to another . 
No really . I have been catching bonuses from Ic. 4 orders 50 dollars thursday. 
Friday 83 dollars extra for 6 orders . 
I did both of them. I got the extra cash . 
I average 25 an hour no bonuses . With these bonuses 38 bucks an hour today . 
Yea it took me 6 hours to complete 6 orders today. Not good . 
Grocery stores were packed with people . The wait to check out took 20 or 30 alone .",2021
post-6861573,ANT 7,"Feb 16, 2021 at 9:28 PM","Nice 20 something woman, working for a major international chain that is quite a popular mid-level restaurant/bar setup in our market.

We hit it off at the start of the 30 minute ride, and it turns out she was in charge of take out and deliveries at this large place on the VD weekend. Decided to interview her on the sly for some UP content........heh.

They turned off all internet delivery apps after the first 2 hours (around 600 PM) because they were getting slammed on all fronts (DD, UE, and STD) and could not handle it. Mainy the apps though were causing the trouble. Too many people ordering and no kitchen can keep up, too many customers complaining, losing 30% in fees and having things sit an hour plus for pickups was the reason. As these are the least profitable orders by far, they got whacked.

Next was pick ups for take out from their own website, which were averaging about 3-5 orders every 15 minutes for about 3 hours straight. They track this metric in 15 minute segments apparently, and promote it with discounts and a points program for members.

They also had a 90 minute line to be seated until close, as they were not doing reservations. Covid here means you can only seat 50% capacity, so, they were being ruthless and doing first come first serve with a 90 min max seating time. Can't say I blame them.",2021
post-6871127,The Gift of Fish,"Feb 19, 2021 at 10:35 PM","I have come to the conclusion that there are a lot of driving techniques that are very different here in the Colonies, many of which fall under the category of, ""How can you not know this?"". 

As such, I'm genuinely interested to know which one of these options you believe to be correct.",2021
post-6830423,Young Kim,"Feb 5, 2021 at 5:43 AM","It started off fine... I picked up 2 pax at a bar in a suburb south of the city around 3:00 am. It was a couple. The guy suddenly started asking me if I was Korean. I replied, ""Yes, sir, I am"". He proceeded to ask me 27 times exactly if I was Korean on a 17 minute ride. Each time, I would answer ""Yes."" After around the 20th time, I started counting it back to him. ""Yes, I am Korean, that is for the 22nd time""...""Yes, I am Korean, for the 23rd time""...""Yes, I am Korean, for the 24th time"" etc. At this point, I went from being annoyed to very amused...

The girlfriend (who was very cute), started to apologize profusely and kept telling her boyfriend to shut up. She was quite friendly and tried to divert the repeated questions to other topics. She asked me if I thought she was fit and cute, showed me her stomach, to which I replied, ""Of course!...""haven't you seen a mirror recently?""

Then... the boyfriend suddenly started asking me, "" ...are you Korean?"" over and over...

I calmly replied that both my parents are Korean, so my genetics followed from that biological fact... He in his drunken state, started to repeat that same question over and over... afraid to get to the 27th time for that question, I cut him off... I then answered by having a short talk about how there are 46 chromosomes in each cell of my body... consisting of 22 pairs, and two sex chromosomes...inheritance patterns, etc. And all this explains why my being Korean has a logical connection to my parents being Korean.

For my own amusement, I quickly pointed out how traits are inherited from each parent through DNA transmission according to Mendelian genetics... and again tried to explain that is the reason I am in fact Korean and not another race...

After a long silent pause... he again asked...""So...why are you Korean?""

I tried so hard not to laugh...

At the end of the ride, the girlfriend apologized again for her boyfriend, and then handed me a twenty. The boyfriend gets out, and is suddenly very friendly with me, and asked his girlfriend if she had tipped me well. She replied that she did and both disappeared into their apartment building.

I thought this ride which started out sort of annoying, ended up very amusing and funny. The 20 dollar tip at the end was very nice.",2021
post-6822887,Guido-TheKillerPimp,"Feb 2, 2021 at 1:34 AM","What was you biggest rookie mistake(s) as a RS driver that hopefully you will never forget, and have certainly learned from?
Myself, always ensure doors are locked upon arrival and ""sizing up"" the 
situation /paxs before unlocking. Especially at night!",2021
post-6866139,#1husler,"Feb 18, 2021 at 11:34 AM","I have mixed feeling about pax, the same as I would about any John and Jane Doe with whom I'd have to interact with out there, I guess.

But there is one variety of pax who I appreciate more than most...its the pax who unknowingly ""aids and abets"" me to weed out their low paying/potentially problematic rides by ""outing"" themselves with messages which reveal the ""true colors"" of what might transpire if I dare PU at their ""pin drop"".

Upon receipt of such messages I quickly cancel, then re-cast my net for higher paying rides/lower drama rides, saving me the hassle of having to haul it 5 mins down the road, only to see a nonsensical ride that I can't work with.

This is a thank you to them, because they keep my economic fly wheel turning, without having to break my vibe or mess up my bottom line.

The pax who sends these revealing message is indeed a special one...because unlike their stealthier counterparts (who KNOW what they/their rides are so mask their true location and/or identity or continually launch new accounts, to woo drivers back into their den), they volunteerily ""tip their hand"" to show me the kinda of ride most likely to suck time, money and energy out of my hustle, possibility ending my hustle on a sour note.

These message are super helpful in my market where U/L don't show pax destination (until you accept all the +25 min away rides and ""score"" a 95% AR or something like, which I DONT have)....one can sniff out rides which don't make financial sense by simply reading and understanding these pax messages.

Here are a few of my ""choice"" favorites, with interpretations:

Pax message: ""We are at the Circle K"" [and its 1am... just scored and need a mule, bruh!]

Pax message: ""I have a lot of groceries"" [so can you load our 2 carts full, drive .75 miles, park your nice new car in section 8 housing after dark and leave it unattended to run my stuff up 4 flights of stairs for $2.25 and..ooh, don't worry because I'll take care of you on the app]

The best one is...

Pax message: ""You are picking my son up from middle school school"" [thus violating your ToS on a ride which is not only awkward but not completely legal, and can result in legal action].

By the way...this message is a good one to screen shot, and then dash to U/L, inviting them to discuss ToS with pax.

Are there any pax messages you all get which prompt a quick cancellation?",2021
post-6870669,Benjamin M,"Feb 19, 2021 at 7:30 PM","So, I have been mainly sticking with Eats recently. 

For a while now, most restaurants have had dine in or in store pick-up around the city. However, a few have shifted to making us lowly drivers go around to the back entrance like it's a speakeasy. 

Had one last week, a Japanese restaurant. People eating inside, doors were open. Got a look of disgust from the host. 

""You are supposed to pick up at the back door. It says so in the app"", with a ""yuck, delivery guy"" attitude. 

So, I went around to the back - a tight alleyway. Saw raw ingredients sitting around with a screen door open nearby. I rang the bell as I was told to and waited in the cold. 

I was finally noticed as the chef went to plop down what looked like a bowl of rice next to the door. Yuck. 

That's just one example, anyone else? And that place wasn't cheap.",2021
post-6851685,Lone wolf hunting,"Feb 13, 2021 at 10:27 AM","On Real Time Feb 12, 2021 Bill Maher called Uber/Lyft drivers rickshaw operators. He’s right. Anyone else sick of pulling a cart around for people that care nothing for you or your well being?",2021
post-6843529,FLKeys,"Feb 10, 2021 at 9:04 AM","Yes, Juan in your red Toyota Sienna, I would like to thank you for demanding a $35.00 upfront cash tip from your passenger last night around 6:00 PM. 

Okay I know chances are real slim that Juan will ever read this.

Yesterday around 6:00 PM I get a ping for a trip 35 miles south, estimated to be 45 minutes long. I pull up and there are 3 ladies, mom and and two teens estimated in the 16-17 year old range. I verify identity and they all pile in the back seat. I know this trip is going to an area that is farther away from my house and chances of getting a ride back to my area will be slim but oh well.

Mom immediately gets on the phone and says we are in a second Uber and should be there in less than an hour. My mind starts to wonder??? Several minutes later Mom gets on the phone again, and I hear here say ride issue, okay she is on the phone with Uber support. After some frustration she gets connected to a person.

Basically, Juan in a red Toyota Sienna came to pick them up. After they were in the car he started the trip and saw where they are going. Guessing Juan does not have Uber Pro Status. She said Juan proceeded to demand a $35 cash tip up front because he would have to drive back 35 miles with no pay. She refused, Juan kicked them out and drove off.

She was going off on the Uber rep on the phone, she also had to repeat twice to the rep ""No not Paul I am in his car now and we are heading to our hotel"", it was Juan that was the problem.

Juan demanded $35.00, kicked out his PAX and his PAX rewarded me with a nice crisp $50.00 bill upon arrival to their resort. She thanked me for a nice safe professional ride.

On a side note I did several trips in that area while I was there and also my final trip in that area took me 14 miles back toward my house. Well worth the slight inconvenience of going 35 miles away from home.",2021
post-6865753,The Gift of Fish,"Feb 18, 2021 at 8:16 AM","Everyone hates Lyft's practice of foisting new rides on drivers as they are reaching the destination of their current ride. I decided to email Lyft to tell them to cut that shit out, not expecting a reply. But, they did reply, evidently not before taking a large draw on the company crack pipe.




Sure, Lyft, I will be sure to disable the ""auto accept"" feature in your app. It's on the fantasy menu, just below the ""stop bugging me with nonsense about 'harming your community'"" button and the ""leave me the F alone and let me get on with my work"" button. &#128514;&#129315;:roflmao: What a bunch of morons.",2021
post-6864983,MissAnne,"Feb 17, 2021 at 11:03 PM","Holy crap .... and hubby has the car &#128546;&#128546;

",2021
post-6859321,The Gift of Fish,"Feb 16, 2021 at 1:24 AM","I got my first puker of 2021 last night. Uber has seen fit to remove the ""request cleaning fee"" help function from the Help section in its app, so I phoned the critical support number. Rohit said to send in photos and he would process the fee. A short time later, I got a message from him that he had assessed the fee and charged the pax $40 for puking on my car. It appears that the days of the insta-$200 puke fee are long gone. I told Rohit that $40 wasn't enough. He wrote back confirming that it was, and I wrote back confirming that it wasn't. It definitely isn't.




Anyway, Rohit said that the $40 would be credited to my account by the next pay statement, which ended last night. It wasn't. After further pressing, Rohit said that it would be paid out ""in the next few business days"". I replied that that was not good enough, and that since he had already charged the customer, I wanted payment now; there is no reason to delay payment. It looks like my emails are now being diverted into Uber's Bottomless Pit of No Reply email folder, though, as Rohit has stopped responding.

Uber puke fees used to be credited immediately to drivers' accounts. Has anyone else had Rohit play the make-you-wait game with them?",2021
post-6853551,MissAnne,"Feb 13, 2021 at 11:13 PM","Even for $26 extra..... not putting people in my car... plus it's snowing &#127784; 
",2021
post-6798965,ANT 7,"Jan 24, 2021 at 12:42 PM","This is the last window you'd ever think would be broken by a road hazard, but, it actually happened.

A pickup truck passed me at high speed on the right, which kicked up a rock, and then, CRACK !!! Took me 15 seconds to realize it was this window which was taken out, because, 99.5% of them seem to hit your windshield, and nothing more......right ? Kept staring at my windscreen looking for the damage, but saw nothing corresponding to the sound of the impact, until I checked my mirrors and saw this.

Dealer list price, because no used parts were available anywhere, was $299 CAD plus taxes.....they cut me 15% off, so I paid $260 CAD plus tax. FWIW an entire new front aftermarket windshield is a mere $275 CAD plus tax installed. Go figure.......heh.

It's only like a half an hour of tech time though to replace it. Pop of the inner plastic window trim, undo two small bolts, pop the entire assembly out (it comes as the glass, and frame, with mouldings attached) put the new part in, then reassemble it.

",2021
post-6858737,Nightrider82,"Feb 15, 2021 at 9:57 PM","It’s been a while since I have been here. I just wanted to share a bit of success I have had and perhaps inspire someone who has been on the fence about taking the leap. In september I officially did my last Uber ride and although it had many ups downs I’m thankful for Uber because at a time of need when I need some extra income I was able to just do that. Uber is a terrible company to work for and after a while it does wear on you and I truly lasted as long as I could, after working a regular 9-5 I would put in 15 to 30 hours a week on Uber and did this for almost 2 years. September of 2020, I finally had enough I was working 7 days a week some days 14 hours a day between both jobs and I just needed a break.
In December i decided to give the stock market I try, my first month was a complete bust I lost about $1200 of my original $5,000 investment and completely took out all my investments. However after doing a lot more research and some studying and following the market I decided to give it another run. Since January 1st I have more than tripled my portfolio with a lot of success, some failure a lot of learning and much more learning left to do. This is definitely not for everyone but if you have an analytical brain and some good sense there is money to be made in the market. No I don’t have a channel, I don’t post what I buy or am I trying to get people to subscribe to anything. However if you have any inclination do your research and maybe start with a paper account, there is money to be made.",2021
post-6829725,The Gift of Fish,"Feb 4, 2021 at 10:14 PM","I see many cars with no disabled placard hanging from the rear view mirror or disabled licence plate parked in spaces for the disabled. It's usually a ghetto-special car, decked out with such crappery as ugly aftermarket rims, too-dark window tints etc, and the ghetto trash driving it is too lazy to walk an extra few paces.

On the other hand, in over-the-top California at least, businesses often have at least five times as many spaces for the disabled as are needed. These spaces very often have no cars parked in them, except for the usual aforementioned ghettomobiles. So maybe no harm is done by taking these spaces that would otherwise go unused.

What say you?",2021
post-6821677,Erik M,"Feb 1, 2021 at 4:04 PM","Drove this past Sat night, was parked on side of PCH in Newport Beach south of the 55/Pinninsela exchange. I'm on my iPad with the music up so was unaware of my surroundings when a guy bangs on my passenger window. I roll it down and he asks if I could give him and his friend a ride, I tell him ""No"". He asks again and I said ""No"". He says OK and they start walking down the road. I continue doing my thing and 10 mIns later the same guy bangs on my window again, I roll it down and he says he'll give me $100 if I give them a ride to the next stop light, which is about 100 yards down the road. Something seemed off, who offers $100 to drive somewhere so close. I tell them ""No, I have a prearranged trip"". He says who the hell turns down $100 for a trip that close, i said ""I do"" and roll up my window. They stand in front of my car talking for about a min then cross the street and jump into a car parked on the other side of the road parked in the opposite direction and drive away. Whatever the hell they were up to, im glad I didn't fall for it!",2021
post-6850965,Mr.Do,"Feb 13, 2021 at 12:14 AM","I was doing some driving tonight, making pretty decent money when at about 9PM I got a phone call. Normally I have my calls screened so that if the number is not in my contact list it goes straight to voice mail, but I happened to have that switched that off because I was making some banking calls earlier in the day. I had a PAX in the car at the time so at first I ignored it, but then the call came again. So against my better judgement I answered. I am paraphrasing here a little bit but the person on the line said he was calling from Uber support and that since I was a stellar driver Uber was going to give me $500. I told him I had a fare and he said he would call back. 10 minutes later he did. He repeated his claim that he was going to give me $500. I parked the car and he proceeded to give my instructions on how to claim my cash. This involved changing the listed phone number in the app to one I did not know and then adding a debit card number to my cash out list. I went along with what he told me to do, but all the time I kept thinking something is not right. Before he could finish the process I hung up on him and tried to call Uber support. But of course it was in the evening and they are closed until Monday. Al the time the number came up again several times and then I got a text stating to call him back when I was ready to finish verification for my money. I am not going to do anything until I can verify this guy is who he says he is by calling Uber support Monday when they are open.

Was this a scam?? I don't know. But there is an old saying. ""When something seems to be to good to be true, it probably is."" Also, if you get a phone call in the middle of the night with a person wanting to give you money, alarm bells should be ringing.

I am pretty sure I almost lost a weeks worth of pay by cashing out to a strange debit card number. I am glad I wised up in time.

So this is a heads up to all drivers, there is some sort of scam targeting drivers out there. Beware of unknown calls offering you money.",2021
post-6829629,ANT 7,"Feb 4, 2021 at 9:13 PM","Got to thinking about this today while watching my AR drop by some 3%.........declined about 10 pings total, during the 11 hours I was out. Routinely I pass on only 2-3, but, it was one of those days today. Didn't take the first four in a row this morning.",2021
post-6834953,The Gift of Fish,"Feb 6, 2021 at 9:45 PM","With these hard economic times of late, many drivers will be cutting back on the amenities they provide to their pax. I saw this on offer on Amazon, and I am wondering if they would have any side effects on them. 12oz of Wag Jerky for $4.10 has got to be a deal in anyone's book.

",2021
post-6841427,Guido-TheKillerPimp,"Feb 9, 2021 at 2:11 PM","Learned some time ago to preview each Uber trip. If a stop is indicated, CANCEL. Especially if it's a 'hood pick-up.
Tough luck, Jason. Perhaps with your next request, some rookie-ignorant-sucker driver, will pick you up with a big, friendly smile &#128515;.......until he/she starts the trip, that is!
",2021
post-6838807,Dave Bust,"Feb 8, 2021 at 1:41 PM","Not to shabby,,,,although i did work 14 hours and had to changes boots and pants 2x and missed the big game but who cares!!

and there was a $3 bonus per delivery and a $4 quest per delivery.",2021
post-6830409,Young Kim,"Feb 5, 2021 at 5:23 AM","Several days ago when it snowed in Chicago (I think it was 8 inches), I was doing my shift overnight and saw at least 10-12 cars get stuck in the snow during my overnight shift. I am reminded of this as it is snowing hard right now on my night shfit. Cars would be turning from the main street into a side street that was unplowed... and would get stuck immediately. I am reminded of seeing roaches simply walking into a roach motel as a kid. It was so sad. I carried a shovel with me in the car, because I knew what would happen. 

I was able to save a few people by helping them dig out in between deliveries and pickups. But I definitely could not save all of them. When I did have one pax in my Uber, another car did swerve in front of me and almost hit us and slid backwards into a ditch. It was probably just a few feet away. I was driving so slowly so I was able to avoid him/her. It was the first BIG snowfall in Chicago in many years, so I suppose that people were not used to it. 

It was really sobering to see all the stuck cars. I myself only stuck to the main roads which were well plowed, and avoided any side streets which were not well plowed... Wait times I heard from pax were over an hour around 3:00 am. I was in a far suburb. When I picked some of them up, they were really grateful that someone was still out to get them. One guy actually said (his exact words, ""Sir, you are like an angel that God sent to me tonight."" 

The surge was good, about $7 per ride... I know I have seen surges much larger, but in Chicago that is pretty big...",2021
post-6835941,Justkeepswimming,"Feb 7, 2021 at 10:30 AM","Here in vegas we have a restaurant called dicks last resort. The premise is the waiters are ******** to the customers. I was pointing this place out to some pax on my drive suggesting they go and I mentioned I’d thought about working there. The pax immediately got excited and wanted me to try it out on them. So I looked em both up and down and said to the guy “she with you?” He nodded. “How much you payin her?” Then I looked at the girl “hey baby, I got a twenty for ya, we can go to the bathroom, actually on second thought that might be too clean for you”.

First time I’ve ever gotten a tip for insulting customers. I could get used to this!",2021
post-6823549,Dave Bust,"Feb 2, 2021 at 10:38 AM","considering there is 2 feet of snow on the ground,,LOL",2021
post-6819873,JohnJames8678,"Jan 31, 2021 at 9:14 PM",Let’s get a thread going of the funniest stories you’ve encountered while on Uber.,2021
