Post,Name,Datetime,Story,year
post-7067344,Classical Telecaster,"May 5, 2021 at 10:08 PM","Was just about to knock off for the night when I got a ping about five blocks from my house. Usually rides at this hour from this part of town is a couple running downtown for drinks. Call it a quick $7 and still five minutes from home. 

Not this time. I cannot make it up the potholed two track driveway. I am about to throw it in reverse and hit cancel when this rough looking country “boy” (looked about 70 to me) comes running up. 

“Hold on, just got to grab my stuff.”

“What stuff.”

“Well, my clothes, a cooler and...my service dog.”

Sh!t. Can’t cancel now. No way that fat beast was a service dog, but I was not going to risk deactivation. 

Turns out to be a twenty mile ride to the best ginseng poaching area in the next county. 

Got in a lot later than I hoped. Oh, the stories he told.",2021
post-7041397,The Gift of Fish,"Apr 18, 2021 at 1:15 AM","
What are your signs that you're done for the night?",2021
post-7067465,EM1,"May 6, 2021 at 12:52 AM","So for fun/curiosity I turned on the uber app just now. Get back-to-back pings, each paxil was 20 miles away. One was a 1/2 mile ride. Thats like 6 blocks. With a $4 sticky surge it was still like a $7 fare. I whispered in full cinco de mayo spirit ‘no gracias’, declined the pings & opened a bottle of red wine.",2021
post-7015887,kingcorey321,"Apr 9, 2021 at 8:18 PM","So i have about 3000 delivers completed with food .
I got my first negative comment today.
Diner . Sir do you think its professional to take your dog with you wile delivering food ?
Me . Yes that dog is a service animal . Me what is the problem ?
Diner .There is a hair on the top of my glass !
Me ok hand it back . I will give you a full refund .
Diner . No that is not good enough !
Me go have a great day .I will Grub Hub myself . Miss its a service animal . It has to go everywhere i go .
Diner BLA BLA BLA and BLA BLA BLA. She starts to cuss .
Me i walk off. I call support .
Support agent could not understand what the deal with the diner . Support agent sounds pissed at the diner for being a total B.....h
Support agent said do not worry you can bring a service animal anywhere i go .
It is not a violation to being a service animal to work with you . Support said she should of gave the drink back to me for a refund .
Blow the damn hair off big deal , Its on the top of a sealed cup . Karma may get her in the future with the same stupidity she showed me .
I though i share this story. Happy to say Gh had my back .
Dog in the car or not . I have dog hair on my shirt jacket seats . It very well could of blown onto the cup. It was very windy today. If it was a dog hair and not a person hair from the restaurant ?",2021
post-7067035,MyJessicaLS430,"May 5, 2021 at 5:07 PM","Yesterday afternoon, I drove back home during lunch break. Ahead of me was a brand new ES with a temporary plate whose driver was waiting for somebody to open the building main gate. Obviously the driver doesn't live here as he walked toward me and signalled that he was picking up somebody. He is an older gentleman in the late 50s and politely asked if I could buzz him in. Sure. I needed to get inside too 🤣 . 

The first thing I realized is his hat that reads US Marine. Out of curiosity, I asked whether he was still actively serving (may be a position of command, intelligence or training the newly recruits, etc). By the time I entered the passcode, he said he no longer served and was no different than any other citizen. Then I thought we would part our ways after a simply reply with ""Oh, I see"". When I was about to leave, the same car was still parking by the garage gate with hazard lights on. I then offered to open the garage gate beside the main gate such that he could wait inside the building. He said ""That is sweet of you but I don't know which floor my  lives"".

Wait a second, did he say ? ""Sorry, by any chance are you driving Uber or Lyft?"", I asked. Later, he told me that it was the second week doing rideshare as a means of distraction from the pain of losing his daughter to TNBC (triple negative breast cancer). ""I am so sorry for the loss, I know how hard it is to accept the reality of tested negative for all the receptors"". Before I answered his question about my background, I thought it was far more important for him to learn how not to be taken advantage of. ""Sir, I know this is not my business but I think you should shuffle and move on. It has already been almost 15 minutes since we first met. You should have cancelled the ride"". Personally I despise any behaviours that abuses the older generations. Unlike the cunning, deceitful and entitled youth, the elder adults are honest and hard-working humans. They don't deserve to be treated like this. 

After leaving him confused, I disclose that I am a former driver. This just gets to my nerves how his kindness is abused. I left him my contact if he wanted a rideshare 101. Yes, that may sound ignorant to be rideshare mentor as I am nowhere close to how experienced most are on this forum but again, he deserves better than this. At this paltry rate, these low-lives do not deserve a brand new vehicle, not to mention a Lexus. ""Allow me to be blunt but you are not going to make money. You are basically giving people free rides"". Although I realize that this is just an activity to keep him occupied, it doesn't make any financial sense in any part.",2021
post-7050376,tohunt4me,"Apr 22, 2021 at 3:11 AM","Driver has Decided to stay away from Uber, because Driving Uber is Not worth Risking his Life !

",2021
post-7063983,mark813,"May 2, 2021 at 10:29 PM","I am a good judge of people though every once and a while they surprise me. I tell my son to never judge someone and the occasional passenger always reminds me. 
Someone that appears to be well off and says they will tip in advance for you going out of your way somehow never does,.
Then on the other hand there is the hard worker you pick up making min wage and you do your job driving them home only to be left a $5.00 tip on multiple occasions.. 
I dont thing the response saying ""says thanks for the tip"" is enough on the app So I would like to take the time and say Thank You! I wish the app would let you type a message.",2021
post-6849265,AveragePerson,"Feb 12, 2021 at 10:39 AM","You were laughing when Uber IPO tanked but now even if they are bleeding millions all day long, Uber is getting more valuable. Lower fare = more earnings! Get with the times, people!

$110Billion+!
$110,000,000,000+!",2021
post-7052984,mthom,"Apr 23, 2021 at 10:11 PM","If this isn't new, I've never noticed it before. Uber looks to be trying to entice us into waiting on scheduled trips here in Nashville now. Had this pop up when I was canceling a ride when I'd have had to wait 20 minutes.

",2021
post-7060684,Benjamin M,"Apr 29, 2021 at 10:59 PM",", this one's for you. ♥ 

Things have been crappy over the past two years for all of us. Lots of concerns regarding health and maybe even losing loved ones. This gig has been unpredictable and more stressful. 



I gained a great friend, a local driver. I have enjoyed our almost daily conversations over several months, sharing our good and bad stories and helping each other out. 

I am thankful for starting a plan toward improving myself (physically, mentally, and financially) and my family helping my wife and I to find a new home. 

I am thankful for the fact that RS and delivery has kept me occupied during this mess and has been mostly profitable. And for this gig getting me out and earning in the first place when I really had no path in sight (next to nothing to $38k). 

Please try to share something positive.  will appreciate that the local driver (name yourself) is likely tired of my endless *****ing. 😂",2021
post-7061570,Jimmy44,"Apr 30, 2021 at 8:16 PM","After over a year off I returned to driving today.
Worked from 3 to 6:30 and took 10 rides. 
The most difficult thing was wearing the mask. I am always aware of it and it fogs up my tinted cheaters.
It's a small sample but I found riders to be a little more appreciative. 
There are more promotions then there were March 2020.
Uber kept my Diamond rating which I will keep until July.
Because Uber needs drivers desperately the entire app is shall I say driver friendly.",2021
post-7057357,Cvillegordo,"Apr 27, 2021 at 2:45 PM","
So yesterday I gave Katie Boulter and her coach a ride to their hotel after her match. (She won her first two matches.) What a gorgeous- and very sweet- girl!! Her coach is from Spain. Here's a photo! Loving the gig this week.",2021
post-7006363,FLKeys,"Apr 7, 2021 at 9:48 AM","Got a counterfeit $5.00 bill last night as a tip. It was a bad attempt. Came from a bartender that I took home. When they handed it to me it felt funny and I looked at it a little later when I had better light. I wrote in black sharpie on it thanks for the fake tip, took it back to their house and taped it to the door.

Probably get deactivated today when they complain to Uber that I came back to their house.",2021
post-7059669,UE for life,"Apr 29, 2021 at 9:54 AM","I tried a new plan, no orders below $10. Why are all apartments gated? The code never works. I'm making $25/hour now. I have not had an apartment all week. Uber tells me u can make $30/hour, but I've never done it. I am never parked. I put 150 miles on my car each day. I'm in north Dallas, and it is lucrative. 7 a.m. to 9 p.m. each day, and i swear i am the only Uber driver out there. I see DD drivers all day long. I never see anyone working Uber. I only do Uber. Order and pay is fixed. My card was declined 50% of the time. I paid no taxes last year. The hours I work and what Uber reports are different. I am Uber Eats, no PAX, no bs. I have worked every shift, 24 hours/day. Anyone one esle know how to avoid apartments? What works for you?",2021
post-7057886,Aw Jeez,"Apr 27, 2021 at 10:27 PM","I read posts on this forum and I get the impression that some of you really don't this job and really don't like our customers. And I always want to ask: Why do you do this? By now, everyone should realize that Uber is not a great full-time job - if it ever was. By now, you can't exactly blame Uber for your particular situation. You've had plenty of time to re-evaluate and get out if that's what you want. And so, again I wonder: Why keep doing something you so obviously dislike?

Middle-aged couple got in the car at a hotel the other morning. Black couple but I don't think it matters. Woman asks me to pop the truck, so I do and then I hop out and help them load their numerous bags. As we leave for the short ride to the airport, I ask them about their stay and such. Just idle chit-chat. When we get to the airport, I hop out and go get one of the little baggage carts they provide. This ain't New York, it's pretty chill here and I didn't have another ride stacked.

""You're the best Uber driver ever!"" the old guy goes. Which I know is not true, but he meant it sincerely. ""Our last two drivers ignored us...wouldn't help with the bags, didn't talk to us...made us feel like we were imposing on him."" I thanked them and wished them a pleasant trip home. By the time I was out of the airport, I saw the $10 tip on top of the $5.71 fare.

Look, this job really isn't that hard or that bad. Just be nice to people...treat them like human beings, not some big inconvenience or annoyance. If you don't like people, perhaps ride-sharing is not the field for you. If you're not making enough money doing ride-share, perhaps it's not the field for you. And if you resent passengers for not living up to your expectations at the beginning, middle or end of the ride, perhaps ride-share is not the field for you.

Me, I happen to love this job! Every day, I thank God that Uber came along and got me out of driving a taxi (which was okay but a lot more work for the money). I've had a lot of fun jobs...but mainly I've been a helicopter pilot most of my life, and doing  job is the most fun I've ever had. No, I'm not getting rich, and I'm putting about 30,000/year on the car, which is fine. Uber/Lyft gives me about $2,400 - $2,500 per month in my bank account. I could make more if I wanted to work harder, but I don't.

Some of you guys really need an attitude check. The passengers are not your enemy. I wish some drivers would stop treating them as though they are. It makes it hard for the rest of us.

",2021
post-7055606,FLKeys,"Apr 26, 2021 at 9:38 AM","Get a ping for a gated community on Saturday. Right away send message asking for gate code. (I am now keeping a list) No response from PAX. I was only a minute away and am now at the gate. I call the PAX and he answers. I say Hi, this is FL Keys from Uber I'm at the gate and need a gate code. He acts all stupid and says he has no idea what I am talking about, he didn't order a ride, and he is not sure he even has Uber on his phone. I say is XXX your address and he says yes. I say well someone used your phone to order a ride you need to go in the app and cancel it if you don't want it. He barks back I don't have the app on my phone and he is going to end the call. I hear a beep and think he ends the call. I go to cancel and I hear in the back ground that he is yelling at someone for ordering a ride too soon.

At that point I say screw it I need a break and gas anyway I'll leave the ride open and wait for him to cancel.

I go get gas, go to a fast food place and use the facility, BS with the manager a few minutes, fill my water cup and head out back on the road. See the ride is still active on my phone. Decide to drive by the place and a car is pulling out so I sneak through the gate. I get close enough to the house to start the timer counting down. Around the 4 minute mark I see another Uber/Lyft car pull up to the house. Pick the PAX up and head off. 

Finally 5 minutes is up and I cancel for No Show. I was surprised to see the no show fee come up as $13.58

Nice little paid break.

",2021
post-7057129,ozzyoz7,"Apr 27, 2021 at 11:56 AM","This time baby I'll be Bulletproof.


I myself was assaulted by a young college student drunk girl. I dropped her boyfriend off anf they were repeat customers of mine and they always got matched up with me when I was nearby. All of a sudden as we were driving at night in the rich Edina homes area, she grabs me from behind my seat and she isn't aware she is choking me and I can't even talk while at same time she pressed her face with smelly melted makeup hard against my cheek as she says ""I hope you get mad p**** tonight"" and i tried removing her arm off my adams apple as she was constricting my airflow and me blacking out means we will end up crashing into some million dollar home.

The fight or flight adrenaline rush kicked in and I had to go SSJ2 with more blood flow to my muscles just to get her large arm off of me. I thought to myself is this German genetics or were womem always this strong?.

I spared her of calling police on her as I didn't wanna ruin her future with a criminal record because she was drunk and didn't know she was endangering myself and herself and stuff outside the car in event of accident. I warned her but with her drunkenness, she didn't even listen to me. 

In another incident an upscale looking man with golf shirt tucked in and looking like a father of your average college students. When we got on the freeway he asks me if I am sending the drug dealers to assassinate him. I offered to kick him out but he apologized so I dropped him off anyways. He was maybe methhead.

In another case in an upscale condo ping, I picked up an Engineer who looked like a young Robert Redford, and we had a couple stops 1 being the gas station and other being his girlfriend house.

When we got to his girlfriend house and parked right in front of it on street where she can even see us if so she checked her large house windows, I noticed the guy wasn't getting out then after a while he asks me ""Can I ask you something (fill in my name here)"" then I replied ""man it doesn't sound good if you have to ask me if it's ok if you wanna ask me something"".

Then he says, ""Can I suck your D quick""? Where D is you know what. I then replied ""your girlfriend house is right there and can see us"" then he asks again and I reply can you just go to your girlfriend? Then he asks again and I start opening my door and he gets scared and exists finally. 

All these incidents are just with 4k rides I had. There are tons of drivers with 20k rides. Imagine what they have seen and experienced. 

When I come back to Uber driving I will so get custom aftermarket bp glass shielding around my car seat separating me from front and rear sitting Pax. No law against it. Plus shootings happen in twin cities where I drove.

It's a crazy workd out there. You guy remember what that Walmart girl did to that Uber driver when she slashed him up to death.

Back to that girl who choked me, in the days following her assault, I noticed increased fat burning and more muscle definition on myself and thought to myself ""I think the body thinks theres danger nearby always now that I survived that incident and body is favouring fitness now for survival lol""",2021
post-7055056,rich5371,"Apr 25, 2021 at 7:19 PM","Last night I picked up a passenger from a Hospital Emergency Room entrance; he was escorted out by a big burly sheriff's deputy and two hospital orderlies (big men). The passenger was behaving a bit odd from the start and I didn't feel good about taking him, but I didn't feel like I could ask him to get out of the car at that point. Big lesson learned.
His destination was 9 miles away, and he was bouncing off the sides of the vehicle the whole way, throwing trash out the window, sounding like he was gagging and possibly spitting, I just held my breadth and told myself we would be at the destination and it would be over soon. We got to the destination and he was laying down on the floor across the passenger and driver area, and he would not get out of the car. After nearly 10 minutes I had no choice but to call 911. He started spitting at things all over the car, bringing up mucus and real nasty spit. After 20 minutes of waiting, he started to make like a tent in the back seat with his shirt, and I'd had enough. I opened up the back door again and told him that was it, he had to get out of my vehicle. He lunged up between the seats into the front, grabbed my bag of personal items and my cell phone and tried to get away. I body slammed him back and he dropped the phone and bag. He was pushed back into the car in that exchange, and I put my head in and convinced him if he didn't get out it would be bad for him. He opened the passenger side door, got out and walked away. As soon as he was no longer in site the Sheriff deputy showed up. I told the deputy what happened and the direction the guy left in. The glass back of my Samsung S9+ was shattered, the deputy asked if I wanted to file a report on it and I said no, not right then. Maybe later. I reached out to Uber and escalated the situation to a supervisor. They are ""glad I'm not hurt"", won't do anything about the spit (no pictures, I wiped the nastiness up with a towell), and offered me $15.00 for my destroyed phone. I sent pictures of the phone along with the receipt. I buy phones outright, it was $550.00. I can't press charges because I can't get the passengers information. I can only imagine one of my adult daughters being put in this situation.

",2021
post-7055088,JeanOcelot0,"Apr 25, 2021 at 7:56 PM","


",2021
post-7056462,Legendary Status,"Apr 26, 2021 at 9:39 PM","Such a beautiful woman, life gone too soon. I hope they find these killers and put them in prison for life.

",2021
post-7054312,Erik M,"Apr 25, 2021 at 3:39 AM","Got a ping tonight from San Clamente and I'm guessing they want to go to Armenia?! Either they are really dumb and don't realize there's a large body of water between us and Eastern Europe or they think Uber has those 007 cars that can turn into subs! Never the less, $4k seems kinda low to drive someone 4000 miles!!",2021
post-6990439,Young Kim,"Apr 2, 2021 at 3:45 AM","Just had a pax who told me the most painful reason I heard that he had to start taking an Uber. A rather young guy, in his mid 20s, coming from a friend's house. He told me that he lost his car and license in Illinois because of unpaid Illinois Tollway fines! When I asked him how much he owed, his answer shocked me. The pax said he owed over $12,000! I thought he meant $1200. But he said he just kept on ignoring the fines until the fines multiplied...all the while running even more tolls and having them multiply. I am not sure how the fines multiply, but I am guessing it was not a simple ""doubling"" like overdue parking tickets. He did say that he was optimistic that he could under the new Illinois law regarding tollway fines to have them significantly reduced under some pandemic assistance relief program. 

I have heard so many reasons why someone had to start taking an Uber everywhere, but this was really surprised me...",2021
post-7029087,Young Kim,"Apr 14, 2021 at 4:29 AM","Just dropped off a pax named Rose. Super nice and friendly. Interestingly for me, she just dropped out of law school to pursue her dreams of being an Instagram star. She told me that she is buying books and researching the topic aggressively. I showed her some of my magic tricks at the end of the Uber ride, and she encouraged me to build a social media account. I just perused some of her Instagram pics. Perhaps she has what it takes. She told me that she hated law school and found it to be super dry, boring, and tedious. I picked her up from a bar around Mount Prospect, IL.

I found it fascinating because as I wrote there seems to be a definite trend, how many young people are seeking to build a career in the world of social media. They are shunning traditional careers and trying hard to carve their own path. Many guys are trying to sell merchandise online, and produce music. Many young ladies are trying to make it in the world of fashion and cooking. She says she is actively advertising her Instagram account and trying to build up a large following. A whole bunch of them are doing loads and loads of TikTok videos. Here are a few of her pics. I can certainly tell from the efforts she has been putting into her pictures and her many many posts that she is dead serious.







",2021
post-6990051,Benjamin M,"Apr 1, 2021 at 11:49 PM","At least here in Richmond Virginia, demand seems to be increasing. 

I've even had pax going out on the town and even a few tourists, unheard of since the beginning of the pandemic. More importantly, in the two weeks that I've been back to pax, a handful are actually tipping! 😂 

But, here's the downside. I've had ridiculously long distances to pick up pax, loads of ""scheduled"" trips, and TONS of dead miles / tolls. 118+ miles for about $85 has been the norm. 

Every day since I fired up X, it has been the same - start the trip, immediately bombarded with pings. Most are crap. I have to sign in again at least six times a day after getting the boot. Why? Because nobody is out driving! 

I fired up the Uber pax app yesterday, the only ants were hopelessly sitting at the airport. 

I want to see more ants. I want to make the same amount without driving way more miles than I did before. 

Nine trips on Uber left for a $120 quest left for tomorrow, then $100 for ten trips on Lyft Saturday. The money is out there.",2021
post-7051214,Benjamin M,"Apr 22, 2021 at 5:05 PM","So, I decided to add another accessory to my car - 




Even with pax looking at themselves in my camera, I've had - 

The final was the nail in the coffin. They immediately tipped me $9 but, had I not turned around to do my sweep (as I do with every pax with a bag), I would have picked up my next pax with a swimming pool in the back seat. 

So yes, I see you.",2021
post-7049839,The Gift of Fish,"Apr 21, 2021 at 7:40 PM","Last night I took a pax on a short ride of a few miles. Upon checking the back seat after he got out, I noticed that there was a liquid stain in the seat about 8 by 4 inches. There was no indication of what the liquid was. 

I got my phone out, took the pictures and then sent them in to Uber with the damage report. I then got the gloves and paper towels out and blotted and dried the stain as much as possible. A few hours later the stain had almost gone, just leaving a faint outline ring. At the end of the night I did the usual routine of Lysol and water cleaning of the seat (have to clean the entire seat base to not leave water stains). It took about 10 minutes to clean.

Anyway, I though that Uber would give me 20 bucks. The next morning they emailed me to tell me that they had charged the pax $150. In contrast to Uber's lowball cleaning fees of late (I recently got just 40 bucks for puke on the car), $150 was too much for this stain. 

What would you do?",2021
