Post,Name,Datetime,Story,year
post-6710321,Young Kim,"Dec 27, 2020 at 9:03 AM","So toward the end of the night around 4:00 a.m. saturday night I was in evanston and picked up a lady with a suitcase. I knew that of course she's going to O'Hare airport. She was very talkative and told me that she wants to tell me a story of true love.

She said that she's reconnecting with someone that she's loved for 45 years. She said that back when she was just a teenager she went on a date with this guy named larry in high school. Both of them were so shy back then that they didn't know how to spark anything up. 

Anyway, years past and he got married and she married some lawyer. They had three children. She said the first 10 years of the marriage were good but after that it fell apart as he got verbally abusive. Then later she found out that he was hiring prostitutes for many many years. She found this out because he accidentally called her phone and left a voicemail talking to one of the call girls that he was regularly seeing. She said she wanted to stick to her wedding vows and also for children so she still stayed in the marriage.

Then 3 years ago her husband was diagnosed with ALS. It progress rapidly. She stayed back from her job to take care of him during his final years. But in february of 2019 she was in jewel and she sent a random text to larry who was still an old friend of hers over the years. 

Larry replied to her that he's in the midst of getting a divorce. She informed larry that her husband is in the terminal stages of ALS and doesn't have long to live. So in february of 2020 he said that he's coming to chicago to visit a friend. as soon as she met him in his hotel room she said there was an instant connection and it was like she met her twin flame in this life. They made love that night and the following night. She said that it was dynamite and it was the best sex she ever had. 

She's then saw him in april then in june then in july and then in september. In september of this year is when her husband finally passed away. She confessed to me even though she fell slightly guilty about it that she was finally relieved that her husband had passed. It was hard taking care of someone with that disease but she wanted to stay true to the promise of taking care of him till the end.

however her children were very angry at her for having an affair while their father was still alive. But in her mind she felt that why should she feel not feel bad because the marriage had been ostensibly over 20 years ago when they were no longer in love. And the fact that she knew that he was having affairs himself with multiple prostitutes over decades., Made it easier to have the affairs because she knew that her husband was going to die anyway very soon.

I did not judge her but during the long ride to O'Hare from evanston illinois I showed her a couple of my magic tricks on my phone. She was so amazed and she said that she wanted my phone number so that she could invite me for her friends or for children's parties of parents that she knows. I said fine and I texted her my number. 

Then later before we left she said that if she was not meeting larry that she would have loved to gone on a date with me! As we left the ride she asked me that when she comes back in a week if we could have coffee.

She was 59 years old and she had a very nice figure skinny ...but I told her that there's no way I would do anything that might compromise her new relationship with larry. I don't think that it was a romantic gesture but rather because she felt that we had such a strong connection. Anyway we ended the ride very pleasantly and I wished her well and she said that she would keep in touch with me about what happens. After a few minutes I started getting texts with her though however.

I just replied that I hope this thing with larry goes well and that you both get married. I thought it was a fastening love story that after 45 years her who was named michelle and this new guy larry could be kindle their 45 year old gap where they knew that they loved each other all along. I did tell her that sometimes this kind of true love does last or take a very long time in this case for her 45 years. but I wish her well and I hope that this new relationship completely works out. And I told her that her children should be understanding and forgive her and be happy for her.",2020
post-6708815,Ignatowski,"Dec 26, 2020 at 11:57 AM","A document you submitted was rejected
The surging airport lot lies empty
Peace on Earth for Christmas Day",2020
post-6696769,MHR,"Dec 21, 2020 at 5:21 PM","
Merry Christmas and Happy Holidays y'all.

I'm interested to know where you guys fall on the Holiday Mood Meter this year? I'm finding myself in the mildly irritated range and that's making me even more irritated because I'm not sure why I'm irritated to being with.

I'm hoping it's just 2020 overload and it'll pass quickly.

So...what do y'all have planned for this year's holiday celebrations? Do you have your presents wrapped already and the tree decorated or are you going the Bah Humbug route? Are you more Buddy the Elf or the Grinch this year? Are there going to be fresh cookies and milk for Santa or is he getting a Slim Jim and warm, stale beer?

Well...whatever your mood and whatever Holiday you might be celebrating I sincerely hope every single one of you can find a bit of joy this season. Lord knows we could all use it.",2020
post-6553712,OldUncleDave,"Oct 5, 2020 at 5:08 PM","Many, I mean a LOT of pax are complaining about drivers accepting trips, then cancelling. Some have been trying to get home for 3-4 HOURS, with 5-6 drivers cancelling on them, even with the (California) multiplier of 4x and 5x.

Now, some of them I can understand, but my philosophy is, if you accept the trip, you should keep it. Maybe a 5 minute window to cancel, but it is about customer service. You cancel, now I have to deal with a pissed off pax, and try to calm them down, else I get YOUR 1* .

Last night, one of my last trips of the night. 6 mile to pickup, 30 mile trip, drop off was a mile from my house. SWEET!

As soon as I accepted, text message, ""Please don't cancel on me! I've been trying to get home for 3 hours!"" 

She has a 4.90 rating. When I get there, she tells me drivers have been 3 minutes away and cancelled.

Just don't understand the mindset of these drivers!!",2020
post-6705059,Germanic Affairs,"Dec 24, 2020 at 3:12 PM","I don't want to be negative in the Holiday Seasons. That is not my intent. Many of you work Uber because you have nothing. Many of you work Uber because you are unempolyable. Many work Uber because they are social outcasts. Many work Uber because they are lazy. Many work Uber because they don't have the ambition to do something else or the ability to use their brains to find something. Like I said I don't want to be negative and emphasize these type of problems, I don't even want to mention them.

Thing is, if you don't do anything things only get worst. Waiting for a miracle is silly. I keep hearing people say ""Thank God 2020 is over"" or ""I am so happy 2020 is finally over"". I merely ask a simple question. Why? Why is it good 2020 is over? What makes you think 2021 will get better? Why couldn't 2021 be even worse?

The only way to better yourself starts with yourself. Don't depend on others. You need to be the one that finds their way out of the trap. I hope with the Holiday Season you are all going back to school or starting school, or starting a apprenticeship or you are starting a job in something that you can get skilled or educated in something marketable or you are getting certified or licensed in something in demand.

Anyways have a Merry Christmas, go to church, confess your sins, and start the New Year's as a new human that is productive and worthy of society. That actually does something for humanity, not just applying for unemployment and accepting pings from your car all day.

Merry Christmas and Happy New Year!!!",2020
post-6694591,Young Kim,"Dec 20, 2020 at 11:08 PM","I was making an uber Eats delivery in lincolnwood illinois. And here are some of the amazing Christmas decorations on many homes... the pictures are not wide angle so it couldn't capture everything but you could get the idea.

Every year I see a caravan of cars, always driving around the area. I always love it when I get a delivery or a ride around this neighborhood...







",2020
post-6705559,TCar,"Dec 24, 2020 at 6:23 PM","Just watched ""Rush"" on Netflix.
If you love Rush then you know!
Merry Christmas

Side note, this is REAL

The Endless Summer of Muse!",2020
post-6703125,Benjamin M,"Dec 23, 2020 at 7:42 PM","⚠ WARNING - buzz killer post. 

Drove passengers for the first time in weeks this afternoon. People were driving like maniacs, as has been the case since the protests - cops seem to have mainly thrown in the towel around here. 

Was driving on I-64, saw a major collision on the opposite lane. Less than half a mile away, came up on a multi vehicle collision with an obvious fatality that had happened within minutes before. 

Had a passenger, felt powerless. Wanted to stop. Saw this poor elderly man dead and who knows about the other car, crashed in the median on the other side of the road. 

If not for me missing a turn because my pax was back seat driving, I would have likely been in the middle of this. Today wasn't my day (or my pax). Saw several other minor accidents heading home, driving carefully as I could. 

Always tell your loved ones that you love them before you leave (I always kiss my pup and tell my wife I love her, even if she's pissed at me for something), SLOW DOWN, and please be careful.

Positives, stacked pings that were all at least 10 miles with minimal distance to the pickup. I swear I was the only driver out, I'd start a trip 20+ minutes away from the next one.",2020
post-6695797,jgiun1,"Dec 21, 2020 at 11:36 AM","I play the river's casino here and there. I put $50 into account, spun like 10 spins on a new slot. I said screw itafter losing ten spins in a row. I left that slot and played the second new one. Bet one dollar, about the 5th spin.....boom.....Major Jackpot ‼‼‼",2020
post-4759591,KAG,"Feb 21, 2019 at 12:34 AM","I have a vehicle through xchange leasing, they assured me that I could purchase the vehicle in 2019. Well its 2019 and now they are saying Xchange leasing is not authorized to sell cars in the state of Washington and that they fired the people who told me previously they would sell me the car for misleading me as well as others. I feel like this is BS and wanted to know if anyone else is experiencing this. Ive paid for this car for 3 years with hopes of one day owning it. My dreams where shattered yesterday... someone PLEASE HELP!!! CLASS ACTION LAWSUIT?",2019
post-6683603,Young Kim,"Dec 16, 2020 at 6:04 AM","I was driving near Golf Rd, and Waukegan Rd around Morton Grove, IL when I got a ping request for UberEats (around $4 payout) at a place called ""Wings and Things"" on the app. It is a low offer but I saw that the pickup was only 1 minute away and the dropoff was just 2 minutes down the street. When I accepted, I immediately got a second ping from the same location. It was for $9 so I also accepted that. When I pulled into the parking lot, I could not find the name on the store window, but saw an open restaurant with the lights on. I confirmed the address number even though it was not the actual name on the front. I called out as there was nobody behind the counter. After awhile, a guy came out. I told him the two names on the order, a ""Dani"" and a ""George"".

I am usually very friendly with my greeting but this guy sort of ignored it and seemed like he was in a very bad mood. I recognized him from earlier deliveries and recalled his unfriendly nature. He curtly said that George was ready but Dani (the 4 dollar order), would be 5-10 minutes. I then very nicely explained to him that the Dani order was a 4 dollar order, and since it is not ready and the second one was on the counter and was a 9 dollar order, that maybe I should cancel that order and allow another driver to take it when the food is ready.

I very kindly told him, ""My friend, if the $4 order can be ready in 5 minutes, then I can wait. But if you think it will take 10 minutes or more, then maybe I will cancel and let another driver take it because it may not be worth it for me to wait?""

(Then he surprised me with the following words)

He abruptly said: ""I really don't care if you take either order because I get paid either way. When I click on the ""accept"" button then I get paid. If you cancel I don't care because I get paid no matter what.""

(and then the following words REALLY pissed me off)

He continued on in a proud entitled way, ""I want you to know that I really don't care at all what  make in tips""... ""Because I get paid...so whether you make nothing or something, ""

The reason why this last sentence really upset me is that he was so demeaning to all delivery drivers. He was not just targeting me, but . He acted so proud as if we delivery drivers were so unimportant to him and what we got paid, because he would be paid regardless. And he said it in such a rude manner. You had to be there to understand it.

I was surely going to cancel...but I remembered reading here on someone else's post that in fact what he said was true, that the restaurant gets paid by Uber whether the delivery is made or not. So I politely said, ""OK, if it will be a short while, then I'll wait."" and I smiled. In retrospect, I should have just cancelled probably, but I was already there, and in the back of my mind I wanted to let him know that I was a patient person and a polite person. After about 8 minutes, he came out with the food. At this point, I calmed down a little, but I tried to explain to him (and this is where many of you may disagree with me because I confronted him) that his words, ""I want you to know that I really don't care at all what you guys make in tips""... ""Because I get paid...so whether you make nothing or something, I don't care"" was rather mean and insensitive.

I said to him, ""Respectfully sir, I wish to tell you that I was not blaming you at all that the food was not ready or that the customer did not leave a decent tip, but rather the reasons why I may have wanted to cancel the order that was not ready. I thought what you said about delivery drivers in general and how you don't care what we get paid is mean and actually rude...""

But suddenly he raised his voice and got all defensive and spoke down to me in an insulting fashion, ""Look, you are not supposed to even tell me what you are getting paid. That is not your job. You guys' job is just to come inside, not say anything, get the food, and leave!""

I realized I was almost to lose my cool... I took a deep breath, and said, ""OK, thanks. Goodnight, and I wish you well and please understa......""

I could not finish my sentence because he just walked away out of sight behind a wall.

Surely if I ever get this location again I will reject the order. But I really had a passing thought of wanting to smack him. I recall I even clenched my fist for a moment. He was behind the counter in a very drab, sort of beat up fast food restaurant with no seating. Why would he act so proud and mighty and say rude and insensitive things to me and about all delivery drivers. He targeted all UE and DD drivers by saying, ""I don' care what you guys make, I get paid anyway"". I did not act angry that the food was not ready or that the customer's tip was lousy. I only tried to explain to him the reasons why I did not want to wait for the second order (indicating that for a tiny payout it may not be worth it if I had to wait a long time).

I am certain that other drivers have had similar experiences. I wish that Uber did not pay out the restaurant immediately like this. Then if I could cancel I may feel that if the food is not delivered then he would be affected. But if he is paid the instant he clicks ""accept"" then maybe this is why he acts this way to delivery drivers?

I did ""thumb down"" the delivery and gave a reason ""unprofessional staff"". I also called UberEats support on my way to the second order and complained. The rep took down my information and said she would forward it on. I tried to find the place again just now through Google to write a negative review to describe what happened to me, but the restaurant name was not even on the search when I typed in the name I recall on the app! I do recall the second order, at the exact same location, even had a different name for the restaurant! It was two words, ""Future"" and then another word. Since the orders are done, I cannot contact an UE support rep live to find the name of the restaurant.

Would you have been as incensed and pissed off as I was? I was disappointed because he acted so high and mighty and dismissive, even though I was so polite and said and did absolutely nothing to provoke him or accuse him of anything. It would be a different matter if I was rude to him first... in retrospect I think that in his infantile world he thought that when I said I may cancel the order if the wait is too long then I am warning him that if he does not produce the food soon that he won't get paid. I think that was what he thought, so he would prove his superior position by stating that he could not care if I did so because he is already paid. But I did nothing to suggest that. At all.

This side gig is becoming more and more irritating by the day...",2020
post-6688689,Slackrabbit,"Dec 18, 2020 at 8:04 PM","Havent seen this in forever! Turned uberx off and now i sit waiting for that juicy surged XL ride! Wish me luck! 
",2020
post-6691399,Stevie The magic Unicorn,"Dec 19, 2020 at 7:48 PM","(Long story short)

The shop I get my rental cab from also has a chauffeur business on the same business model more or less. Aside from booked chauffeur fares they are also on the Uber platform.

This morning I was talking to one of the chauffeurs and told me that he got deactivated off Uber for a bullshit face mask complaint.

In the middle of the ride he asked the customer to put her face mask back on then she accused him of not wearing a mask while driving her. This lead to him losing access to Uber.

“Dude that sucks, your not in trouble with Mears over that are you?”

No, this was a month ago and they just gave me a copy (company lingo for chauffeur fares) driving one of the execs today so I’m sure I’m fine.

“Makes me feel better about my Uber rating” I tell him.

“my friend eventually everyone gets false complaints. Don’t worry about Uber eventually we’ll all get kicked off.. I’ve been at Mears for 20 years and driving VIPs for 15. But I’m still dream team so don’t worry about Uber at all”

“wait your one of the guys who gets the Saudi princes and whoever?” I ask.

He just chuckled at me and nodded.

Yeah the guy who has been doing this for 20 years and is trusted with Saudi Princes gets a false accusation just because he politely asked her to put her face mask back on.

more talking later and he said that he only picks up a car on days that they have chauffeur business for him to do. I looked over his shoulder and recognized the name of his clipboard of his customer.


the ceo of a Fortune 500 company that regularly makes the news. He’s chartered for 4 hours today to pick a party of 4 up from Disney and take them to dinner off to bar and then back to their hotel.",2020
post-6686133,Ozzyoz,"Dec 17, 2020 at 7:40 PM","Some of you are aware I mid a ton on stocks of Uber, but I also wanna fill you in on Litecoin. It is about to explode and it is only $100 right now. It went from $44 to $100 in just like 1 or 2 months. Bitcoin hit $23,000 and Litecoin is skyrocketing. Get in this bad boy guys. Robinhood allows trading of Crypto and so does WebBull. Also I helped many others guys get into XRP back in 2017 and I turned $500 into $80,000 can you believe that? proof is here.




I just bought $1k in Litecoin. I just spent $1k on litecoin.




Here is the 2017 XRP massive gainz baby",2020
post-6478244,Young Kim,"Aug 26, 2020 at 9:00 PM","Picked up a pax just north of Logan Square in Chicago who was extra bummed out because the largest dark web marketplace, called Empire Marketplace, shut down with the owners stealing up to 50 million dollars worth of Bitcoin a day ago. His name was ""B"", and we started out talking about how the economy and the job market is terrible. He told me the business for drug dealers is good. He then went on to tell me he sells a lot of adderall, weed, coke, and Xanax ""ladders"" (as he called them). ""B"" told me that regarding Empire, that was his main source to get things to sell in Chicago (I understood the underground site lets you buy anonymously and pay anonymously with Bitcoin, a cryptocurrency). But he informed me that the marketplace disappeared, and the owners of the site ran off with 50 million dollars a day ago. He was sad that now he will have to start finding a new source for goods. (He was using someone else's Uber account, a relative he said. And I didn't know that he was not using an account associated with his own name until midway through the ride until I kept calling him the wrong name and he corrected me).

After the ride ended, I verified that he was correct, a site called Empire Marketplace did in fact go down today, but I see that 30 million was stolen by the site owners.

",2020
post-6685173,Stevie The magic Unicorn,"Dec 17, 2020 at 5:05 AM","So I decided to actually do some delivery action yesterday. Logged on at home, First ping, Rolled up on a pickup and found myself in a residential street and the pickup was at a house with the garage door open.

I canceled the order, called a buddy I know from the airport. His wife works for the county food inspector, have her call me back.

She asks me for the restaurant. I give her the address ""one sex"" and 4 seconds later ""no, do not pick it up, do not deliver it thank you for the tipoff"". She tells me to save her phone number for the next time I run into it.

""So how do you know?"" I ask her.

""The address isn't on the list of establishments with the county"" she replies.

""Can I get your ""Do not deliver food from that address emailed so i can forward it to Door dash?""

""Sure, one sec""

And I got the email from the .gov email address. Forwarded it to Doordash.

I actually got a response back...

They actually got in touch with my friend and shut down the restaurant on the app.

So some people actually .",2020
post-6687433,Cvillegordo,"Dec 18, 2020 at 10:17 AM","Picked up a young woman from a gas station late last night, just closed. I have driven her before; pleasant, talkative girl. She told me that she crashed her car yesterday in the snow. She works two jobs; the manager from her other job came and picked her up. Her manager from this job would not pick her up. This triggered her. ""He told me that I needed to call a taxi or Uber. I can’t be spending money on Ubers just to go to work. He gonna' have to come get me, or I'll have to let this job go.""

I was not surprised, but I was speechless. What I wanted so badly to tell her was; ""It is not your manager's responsibility to get you to work. That is YOUR responsibility."" It could have been a life changing teachable moment. Sigh.",2020
post-6687979,kos um uber,"Dec 18, 2020 at 2:41 PM","[HEADING=2]Uber driver -- an Iraqi refugee working to bring new wife to U.S. -- on life support after suspected mistaken shooting[/HEADING]
",2020
post-6685827,Jarl Varg,"Dec 17, 2020 at 4:03 PM","I see multiple work gaps,
I see no education or education that never produced a job,
I see old-timers who got chewed up in their industry and can't do anything else,
I see people who can't even hold a residence for a long period of time, evictions, and are always in apartments that don't check pay stubs,
I see over a year of receiving unemployment durning the pandemic,
I see 3 years rideshare driver.

I stamp on the papers DENIED. I ignore their calls or tell them we will let them know.

The end.
",2020
post-6687891,MyJessicaLS430,"Dec 18, 2020 at 1:51 PM","I want to share these 2 deliveries which did not have a good start but ended sweetly.

Can you people really shuffle food these days? I thought I could with this one after making 2 futile attempts in calling the customer. It was a $50 order from a pizzeria that could translate to my dinner that night and also feeding me the following day. What is the logic of the 5-minute timer if drivers cannot keep the food? Not advocating for shuffling here but don't we deserve to be compensated for the waiting time?

As what you would expect from Lyft, Postmate also loves to sneak in an ""offer"" without notifying us. At first, I thought it was not a big deal because the drop off location was added along the route. Not until I slided the ""complete pick up"" button, it was too late to realize the possibility of scam due to the red flags of ""teen"" and his message ""I don't want my parents to know"".




Days after the failure to shuffle the pizza and Lasagna bolognese, the customer tipped me decently.




To my surprise, that underage customer also tipped me 2 weeks after the delivery. I am certain that he did tip because the $10 tip from the first delivery showed up the same evening. However, I still do not have any faith in the younger generations. Keeping the photo I took at his front door and also a selfie video showing I walked back to my car empty will become extremely useful should one day his boredom provokes him to do something dirty.

",2020
