Post,Name,Datetime,Story,year
post-6474471,Young Kim,"Aug 25, 2020 at 7:21 AM","I picked up a pax tonight from a pizza making factory, initials were ""A"" ""R"". Very nice guy who was half Irish and half Italian. What made this ride stick out was that he told me that he was a graffiti artist who tagged a bunch of businesses and public areas in downtown Chicago. I drove him up to Libertyville, IL, so it was a very long ride. He showed me a bunch of pictures and gave me his Instagram page where he puts up his work. He said that every single one of his friends are not white. Dad works for FedEx as a delivery driver and tells him whenever he sees his son's work as he drives around Chicago delivering packages for FedEx. Funny thing is that he told me his dad was actually proud to see his graffiti all over Chicago.

Even though he lives and works so far in the suburbs, he told me his one mission right now is to save enough money to move back to the city. There, he says he can hang with ""his homies"". He says he can't get along with other whites, and would rather date non-whites. I asked him if I could put up some of his images on UP.net and he was so happy to give me permission. He said he found it absolutely thrilling to ""tag"" especially downtown landmarks. Unfortunately, he told me that some of his crew were snagged by the Chicago Police for tagging ""The Bean"" (a large art statue in Millennium Park). He was very atypical, very anti-establishment, into theories of MK ULTRA and believing that the government is a truly evil entity bent on subordinating the ""innocent lost sheep"" as he liked to call the people.

Below are some of his personal work that he sent to me on my phone:






",2020
post-6604670,Lauri1232,"Nov 1, 2020 at 8:27 PM","Last night I picked up a couple under the females name ""Jane Doe"" and was headed to their destination and all of a sudden the name of the passenger changed but I didn't notice until we got to a home and it said ""picking up John Doe"".
I asked ""is this your destination and they said ""No and my app says sharing a ride with John Doe"".
They weren't interested in sharing a ride with anyone and this caused me to take them out if their way so they were upset with me.
I had to start John Does ride and then complete it in order to get it off my app. It was very confusing for me and the passengers.
Does anyone know what happened and how to prevent that in the future?",2020
post-6550971,Young Kim,"Oct 4, 2020 at 4:13 AM","Trying to get in car at 3:13 am. Peeing out of bag...






Ten minutes now...

Difficult fit into a Prius





Stuck..

Finally in

Had to take apart wheelchair

16 minutes plus to put pax in car

(Blocking address)

finally at.. destination but now I'm trying to put the wheelchair together that was in my trunk...



I finally assembled the wheelchair

Unfortunately the passenger actually peed in my car!",2020
post-6430799,Illini,"Aug 7, 2020 at 10:10 PM","Rolled up to a budget hotel. A guy and his 2-ish year old daughter come out of the front door toward my car. I lowered the window and said ""she needs a car seat"".
He said, ""It's OK, she'll sit on my lap"".
I said, ""No, she needs a car seat. It's the law"".
I wasn't ready for this, but he said ""OK, I'll bring her back to the room, then I'll be right back"".
He came back in 2 minutes, and got into my car. I apologized and said that the law requires all kids her age to be in a car seat.
He said ""no problem, it's OK"".
As we head toward his destination, I'm thinking I hope someone else is in that hotel room. If he was going to bring a baby into my car without a car seat, maybe he would just leave the baby alone in the room while he was gone. :frown:",2020
post-2024300,Steven Ambrose,"Jan 26, 2017 at 9:13 PM","Okay, this happened to me as a passenger. It happened last Saturday night, in St. Pete. I was at the local watering hole and some guy came up to me and starting striking up a conversation. I am normally cool and talk to everyone, but this guy seemed downright strange. He kept working his way closer and closer to me and then I walked away. I am a strong believer in personal space. I sat at the bar and proceeded to order another drink. This same guy came over and just sat down next to me. I said ""Sir, I am saving that seat for someone"". He looked around and laughed. At this point, I moved to another part of the bar. This guy started to move over and I told the bartender to tab me out and she noticed the situation and did not hesitate. I quickly got on my phone and ordered the Uber. 

The pricing was at surge and the driver was 7 minutes away. I said ""Sh*t"" under my breath. I signed the receipt and started to head for the door and the guy was chasing me at this point. I walked outside and waited for my Uber driver. The guy came out of the bar and I just stated that I was waiting for my ride. 

The truck the Uber driver is in pulls up and the guy pulls me by the arm and I pull away and just say ""Leave me the hell alone"". The Uber driver then places his truck into park, steps out calmly, and pulls a switch blade. He says nothing and the guy lets me get into the truck. I am scared and the driver insists I sit up front. He tells me that he had to do that several times before, but he has never had to do that for another guy. I thank him for the ride, tipped him $10, and got home SAFELY.

I was stunned that the driver stood up for me like that, but I guess it happens.",2017
post-6603195,4Runner lover,"Nov 1, 2020 at 12:58 AM","I have four Saturdays in a month allocated for ridesharing. And I will drive until Uber kicks me offline, like it did just now 😃
I want $1,500 in a month extra income.
It wasn't a bad day today. $421 came at $1.47/mile-on-the-odo. No, it is not my 4Runner 😁. I decided not to sell my other car.

Sunday is my fun day. Uber on people! Good night everyone 😴",2020
post-6601474,Young Kim,"Oct 31, 2020 at 1:33 AM",I brought a delivery from wendy's somewhere in mount prospect illinois and I just delivered to the coolest house ...it looks almost like a carnival! the lady saw me approaching and open the door and I congratulated her that she wins the prize for me for the most amazing Halloween house!!!😀,2020
post-6602003,Jason15215,"Oct 31, 2020 at 11:57 AM","I barely drive now. Dont feel like driving with a mask but decided to last night. One of my fares was 2 girls leaving a bar to go back to Carnegie Mellon University. Was my last fare. Go home and see a pink laptop case. Wake up this morning to some missed Uber calls which I expected. Get ahold of the girl and she is frantic. Turns out her laptop has all her school stuff in it and its only backed up with a flash drive which was in the case. I wanted a bit of drama so I told her I had some fares after her and when I got home I didn't notice anything in my car but I'll check and call her back. Tell her I have it and offer to drive it to her since I'm 10 mins away
We set up a time and I bring it to her. She tells me her Dad Venmo'd money to her to give to me
She proceeds to hand me an envelope with $150 cash! Good tip for 20 mins of my time!",2020
post-6582897,Benjamin M,"Oct 21, 2020 at 8:14 PM","Had some decent legit ""shuffles"" today.

-

Vague GPS in a strip mall. Parked on the pin, sent ""I have arrived"". Just before the timer ran out, I received a reply - ""ok"". Okay? &#128514;

I was about to pull off when an Asian woman came around the corner and flagged me down. Fine, drove up to her. She was on the phone and clearly didn't speak English, the pax name was male.

She kept pointing, then signaling to stop, then pointing further away, etc etc (while on the phone and walking) for a good while. I asked where we were going, no reply. One last point, ""Rider did not show up"" - and finally some English - ""Here!"". Sorry, time way up - about five past the cancel limit.

$6.12



24 minute ping to an Italian restaurant (that's basically every trip here now) at around 2pm. Again, on the pin, texted ""I have arrived"".

Dude passed out on a bench, assuming he was my pax. Premium pickup plus a small surge.

$10.93



Immediately after the drunk, Walmart 4 minutes away. Same drill, parked between both doors with my hazards on, scanning for my pax.

Just before the timer ran out, ""I don't see you"". Told them where I was (had DF set). Scanned for anyone who appeared to be looking for me, gave them another 4 minutes, gone.

$3.56

$100 in three and a half hours (7 completed trips) but tons of miles. Keep accepting shitty pings because I miss seeing trip duration and most suck anyway now.",2020
post-6102110,Benjamin M,"Apr 7, 2020 at 10:41 PM","So, I applied for unemployment last week and was denied because I have been an independent contractor for a long time - most recently, ride share. States are struggling to catch up with the changes, including Virginia, and delivery / transportation is ""essential"".

Out of necessity, I began delivering food yesterday. Made $70 in three and a half hours, today around $100 in around five.

Saw some things that made me chuckle.

People wearing masks alone in their car or riding bikes / jogging with nobody around. There's no evidence that this is airborne, folks. Person to person. But pollen is pretty nasty right now.

People wearing masks with their nose not covered. Know where they insert the swab to test for COVID-19? (Well, technically, nasopharynx). Wear it properly or don't wear it.

Advance Auto, associates think that it's a better idea to handle items brought to the counter and then taking your credit card or cash, pushed back and forth on a cart. Not washing their hands. They've managed to actually INCREASE contact.

And their delivery guy, buddies, other associates? Oh, they know them, so no need to do anything differently. Because it's just ""stranger danger"", right?

Grocery store. I was standing on the ""six foot"" mark, moved maybe three inches from it and the associate told me to step back. Then, came around the Plexiglas divider they've put up (again, still handling items, and it's pretty pointless), about 14 inches from me, to say ""thanks for not buying more [TP] than you need"".

I guess my point is consistency and common sense.

(This was posted on Facebook as well. Guaranteed that my friends working at home or living off of family, disability, unemployment, welfare, etc. will shit on me for working)",2020
post-6596546,Stevie The magic Unicorn,"Oct 28, 2020 at 3:20 PM","So I got supoenaed again for that murder thing in 2019

The guy finally got a new trial date after it was delayed due to covid.

I'm on call for February 22 to March 5th 2021

Sucks for this guy cause he's been waiting in jail without a trial since 2019.

Don't be a murderer...

Here's the subpoena for the doubters..",2020
post-5601750,Dave Bust,"Nov 23, 2019 at 6:55 PM","I'm sick and tired of going through uber for my cleaning fees so i just took it from the passed out drunk guys wallet.

and a little tip for myself",2019
post-6599483,Cvillegordo,"Oct 30, 2020 at 12:30 AM","Big party night tonight in my town. The following were in my car:

A girl in a ""Rocky"" costume. I said; ""cool shorts!"" She said; ""Matching underwear."" and showed me. Best tip I got all month!

A ""s.l.utty bride"" wearing a ripped up micro mini wedding gown that was impossibly indecent. 

A ridiculously hot ""Wonder Woman"" who put her lasso around me from the back seat when we stopped. It was a bit alarming but I liked it.

Three ""Playboy bunnies"" in translucent body stockings. Voted ""most likely to get arrested.""

A very drunk ""naughty nurse"" with naughty bits hanging out.

I could go on; it was a fun night!",2020
post-6588919,Rlgeames12,"Oct 24, 2020 at 6:01 PM","I checked my earning this evening and they was about $230.00 more then they should have been, after looking through the statement Uber went back from the 8th of October and added all the promotions I was entitled to on my earnings, I thought that was pretty cool, they owed and they are paying up, I would have never known it. It was a big surprise to say the least.",2020
post-6511982,justaGoober,"Sep 13, 2020 at 4:00 PM","I don't think you will see me on the ""quit"" forum anytime soon, but lately I don't seem to have much drive to stay out really late like I used to. The interesting thing is, about 6 weeks ago, I had my best week - when Uber and Lyft (especially Lyft) were offering very good promotions....but the last 4 weeks have been bad - I guess since the unemployment ended, there are many more ants so there's no need to offer meaningful promotions. And maybe that's the problem - I got a taste of a pretty good hourly rate for a few weeks, now my rate is down about 20%. It's hard to take a pay cut.

I've been part time for about 20 months - 4,300 rides total. I did stop for about 10 weeks when Covid started..I know much of the below is obvious, but I thought I would list what I've seen lately. Maybe this is just the normal progression of anyone that does this for a while - at least I made it this long. From my understanding, about 95% quit within a year.

Again, this just may be the normal progression of someone that has done this for a while. I know 20 months is not long for most jobs, but it's probably equivalent to 20 years in a non Uber job. I have the utmost respect for those that do this full time. I don't think I could....",2020
post-6528408,Kurt Halfyard,"Sep 22, 2020 at 10:23 AM","I should have known better. That is the primary lesson here.
It was slow last night and I (FOOLISHLY) accepted a 4.66 STAR passenger, lets call her ""N"" who happened to be nearby at 10:40pm, and was (via Uber Pro's time and direction info) doing a halfway decent length trip on UBER.
I arrive in the condo-townhouse complex.
Three people smoking on the stoop.
N walks towards me with a pizza box (Pizzaiolo, Small) in her hand.
I roll down the window as she approaches and ask, ""Do you have a face covering?""
She holds up a mask in her hand.
I say, ""Can you please put it on?""
She says, ""Yes"" while trying the handle.
I roll down the passenger rear window, ""I'm going to need that on before you get in the car.""
She angrily THROWS the pizza box in my car (nearly hitting me in the head).

Enough of this. I haven't started the ride yet. Count down timer is still going. Time to SHUFFLE for No-Mask.

She starts screaming behind me.

I leave the complex and notice that she has also flung her phone into my seat.

I am driving along Thomas St. in Mississauga and am about to pull over when a JEEP pulls up behind me at high speed, then make a sharp swerve in front of me at the Thomas Glen-Erin Light. There is no traffic at that hour. 
Her two smoking buddies (dudes) get out of the jeep and cross their arms. She comes running out, ""You STOLE my phone *******."" 
I reach in the back seat, grab her phone, and hand it to her, silently. I'm not going to escalate this any further. She gives me the finger, and screams again as she gets back into the Jeep. Her pals do a 'donut' around my car in the middle of the intersection. Another driver who has stopped at the red light on the other side of the intersection looks on with curiosity.

I drive off to another block, park on a side street and end the ride, selecting ""NO MASK""
I discard the pizza box left on my seat from the throwing incident. (It is garbage day tomorrow in this neighborhood, so I just leave it with one of the houses curbside pile of trash, which had a few Pizza Nova boxes off to the side).

I file a report with Uber's App ""Trip Issues"" but have to attach it to another previous in the day cancelled ride (as the last ride doesn't show up in my history, because the ride was not started beyond the 'count down clock screen'.)

I get another ride request while I'm doing that. Just before I drop off the passenger, I get a phone call from the UBER Safety Team. But I let it go to voice mail, as I'm still completing this current ride.

I call them back, and talk to the person, explaining the above to UBER Safety -- passenger N with the 4.66 STAR rating was out of line with throwing objects into my vehicle, and then chasing me down at speed on a residential roadway. They say they will look into it.

My account goes ""OFFLINE"" minutes later. with the BLUE STRIPE in the driver app, ""YOUR ACCOUNT HAS AN ISSUE""

Ancient Corporate Proverb: No good deed shall go unpunished

Currently the account is temporarily on hold, but when I try to log in, it says,




I filed another email-ticket with UBER Support (I can no longer send texts through the app due to lack of ability to log in.)

UBER SUPPORT got back to me at 6:52am this morning, saying all was cleared up, but I still cannot log into my account. (I cannot log into my passenger account either, same issue.)

Fun Times.",2020
post-6590310,Frontier Guy,"Oct 25, 2020 at 2:39 PM","Everyday I see more and more of these articles about how badly airlines are treating passengers, then I listen to my wife comment on the things she hears from from airline passengers (she works at Denver Int'l Airport). Yesterday morning, dropped these two women at the airport, both were not looking forward to the flight. They travel every two weeks Denver to NYC, just listening to the BS they put up with on their flights.

After dropping them off, I got a rematch, a pickup on the opposite side of the airport, ""Terri"", I pull up, Terri is there with a friend, they are both FA's for Delta. The entire 35 minute drive to take them home, I listened to them bash passengers and how disgusting they are, that they want to kick them out in mid-air., how they want to hit them, etc.. 

After listening to both sides, and knowing what we drivers put up with, I've decided to side with the riders, and will no longer give rides to flight crew. If I pull up to the pickup and it's a crew member, I'm simply going to cancel the trip, eat the cancel, and drive off, let them figure out a different way. Quite frankly, they want to treat passengers like crap, maybe they should understand what it feels like to be treated like crap too.",2020
post-6596487,Hillesbrand,"Oct 28, 2020 at 2:48 PM","Found a nominee for Rideshare Driver of the Year in Melbourne
",2020
post-6591798,FLKeys,"Oct 26, 2020 at 9:33 AM","This past week was a real slow one. I logged 78h 5m online for the week and received a whopping 19 pings.

I went from 10:37 PM Saturday night until 6:51 PM Sunday evening without receiving a ping. Over 20 hours with out a ping on a weekend.

Wednesday 5:00 PM to 11:00 PM and Thursday 4:00 PM to Midnight I was online and never received a single ping either day.",2020
post-6593665,Monica1965,"Oct 27, 2020 at 6:07 AM","Beware of using pepper spray to defend yourself! I was just PERMANENTLY deactivated for pepper spraying a guy because he was verbally abusing me, grabbing my shoulder and threatening to ""jack me up!"". All because I wanted him to wear his face mask! I have video to prove all, but Uber took Riders side and left me unemployed. I was a Diamond driver with a 4.94 rating and they didn't give a sh*t!!!!",2020
post-6590701,UberChiefPIT,"Oct 25, 2020 at 7:03 PM","

C'mon, man. You just ordered this garbage. Pay attention!",2020
post-6386975,MMAdelivery,"Jul 20, 2020 at 12:30 AM","Wouldn't that be great if the James Franco , seth Rogan , Jonah Hill and rest of the gang came back and made a movie about uber/lyft etc. There could be scene where seth Rogan gets beat up by a Chinese taxi driver that he mistakens for someone from the middle east .well cause that's all he ever does . it could be called ""this is the end Part 2"" Hahaha j/k that would be terrible",2020
post-6583637,Stevie The magic Unicorn,"Oct 22, 2020 at 3:12 AM","So I was working close at Disney last night (Wednesday)

I pulled up in front of Disney springs (a Disney owned outdoor super mall/collection of restaurants )

""How much would it be to go to UCF?""

""Probobly like $80 on the meter give or take.. i'd do it for $75, If you want an absolute up front price, I can do cash or credit""

""Come on guys let's go he's charging half of what Uber is!""

And then 3 coeds crammed in the back seat of my taxi...

They ended up splitting the fare 5 ways between the three of them $53 in cash and $28 in credit/debit.
($81 total minus a little bit in credit card processing)

Why did I have to be honest? I could have pulled literally any number out of my furry behind but noooo...I knocked $5.00 off the mileage and didn't even charge tolls.

And
",2020
post-6590890,kingcorey321,"Oct 25, 2020 at 9:14 PM","So me the prices are stupid cheap . You can buy items for prices unheard of . 
Have you used this website before ? I cant find anything about it . To me it looks like a scam. 
 Mods i am not trying to advertise for this website not spam. 
They have car cams so cheap it does look real.",2020
post-6586973,ANT 7,"Oct 23, 2020 at 5:18 PM","-15 celcius here in Calgary, and snowing just like someone is standing on your roof top tearing an endless supply of big fluffy feather pillows apart. It's been like this non-stop since 600 AM when I started driving.

Made $225 in 6 hours and came home. You can't go anywhere now anyways, because everyone is trying to get home in their cars, and traffic is at a standstill, because no one has their snow tires on their cars either. This pic is from my living room balcony.

Going out tomorrow AM for 6 hours because the snow is not forecast to stop until Sunday, and I'm expecting to exceed $200 before lunch again.

",2020
post-6590046,Cvillegordo,"Oct 25, 2020 at 11:19 AM","Good days in my area this week; $270 yesterday in just under 8 hours of driving. Lots of winery traffic, tons of visitors, weddings, and a gorgeous fall day was the perfect combination. My final ride of the evening was a Waffle House scheduled pickup at about 11:30 pm. I thought (of course) that ""nothing good is waiting at Waffle House after 10:00 pm"" but decided to check it out, it was on my route home and a 15 minute trip. Four (very!) nice young women were waiting, probably grad students. All holding coffee cups, all clearly intoxicated. Due to the way the parking lot wraps around, I was on them before I could cancel, and they immediately approached the car. I rolled down my window and said ""Uber X is maximum three passengers due to Covid guidelines."" (I no longer take four under any circumstances.) The response was, verbatim; ""Don't give us that bulls.h.i.t.! (Instant cancel decision made.) We have been taking Ubers all day and not a single driver said a word. Besides, it's FOUR, not three."" My response; ""Sorry girls. This is clearly shown on the Uber app, it is definitely THREE."" At this point I still can't roll away due to cars in front, I want to get around to the other side and wait the 5 minutes. Their leader's response; ""First of all, we're not girls. We're women, and we're graduate business students. Don't EVER call us girls, you creepy old f.a.r.t.! Second, you HAVE to take us, this is a scheduled trip."" At this point, I'm getting all sorts of flashbacks to being a cop but I bite my tongue; entitled graduate business school students can be extremely annoying. My retort: ""There is nothing inappropriate about calling you girls. And in fact, you are now acting more like 19-year-old sorority girls than graduate students. I take what I do seriously. I do not take four passengers for Uber POLICY reasons; for safety and insurance requirements. Please request another Uber. Oh, and I'm also a biz school alum; class of 2002. Ask your class mates if they have met me; look me up in the alumni directory. I DO NOT appreciate being verbally abused."" Boom. At this point THEY cancel and I get the fee. Not a murmur as I roll away. 
Once before I encountered a group of MBA students who asked a couple questions about my profile and actually laughed when I said I was an alum; ""Yeah, right!"" sort of reaction, followed by ""Name two of your professors."" As if most of my professors are still there, nearly 20 years later. So I pulled over, asked for their school email (which one guy gave me) and sent him an email with my alumni email address. I have seen the same guy a few times since and he's always friendly.",2020
